keyword,text,target,hashtags
riot,torrecilla info secret lol game check secret riot point bio,0,
riot,transwoman drag queen color lead riot know butch lesbian usually credit incite,0,
riot,pre order film itune watch yay,0,
riot,ally near use skill hire cause make riot staff member look incompetent,0,
riot,pop quiz prefer feminist revolution fry ravioliåêwith porcini,0,
riot,know start riot make sense credit particular individual,1,
riot,juan carlos salvador secret tip riot point lol check secret bio,0,
riot,southeast dirt riot series crown champion southeast dirt riot series crown championsblackfoot,0,
riot,sweetpea run riot allotment brighten rainy day,1,
riot,riot police intervene southampton vitesse arnhem supporter clash fan clash buildup,1,
riot,cracker white riot nowplaye,0,nowplaye
riot,government care police stop riot eventually protestor eventually skyscraper plant cover,1,
riot,new doco tonight pm setanta sport ireland freeview large police presence soccer game ireland stop prevent rioting,0,
riot,eric clapton shoot sheriff guess people riot right,1,
riot,kill val riot emmerdale,0,emmerdale
riot,money buy happiness lie tell poor people rioting,1,
riot,bloody hell upgrade rioting hyperbole saintsfc,1,hyperbole saintsfc
riot,twitter count rioting financial collapse brazil,1,rio2016
riot,black dude antioch riot,0,
riot,recently meet discuss race relation america benefit rioting loveislove,0,loveislove
riot,people charge inevitable rioting contribute lie,0,
riot,cindy heartbreak baltimore rioting yahistorical undergroundrailraod,1,baltimore rioting yahistorical undergroundrailraod
riot,leed fan rioting embra low league cup final dee dum,1,
riot,riot couple hour leave class,1,
riot,plenty black people riot tosu win championship,0,
riot,ferguson riot work time rioting change fix,1,
riot,bbcnews ass british insurer say rioting cost insurer police number reduce blind fat contr,1,
riot,bhramabull watch run jewel use fact defend rioting ferguson socially minded duo take,1,bhramabull
riot,think twitter invent insomniac rioting wee small hour,0,
riot,people riot justice serve murderer bar simple justice peace justice peace,1,
riot,riot gmail,0,
riot,rioting,1,
riot,money tomorrow rioting,0,
riot,sweden venezuela day rioting venezuela riot direct,1,
riot,rioting happy valley penn state lose,0,
riot,group mascara smear girl rioting horrific think,1,
riot,time high profile sign nffc city riot wesley verhoek household,1,nffc don'tpanic
riot,alternative legal alternative protest rioting peaceful thing demonstration,0,
riot,sick criminal parent friend riot kill police damn officer,1,
riot,rioting begin prior decision indictment make sense,1,
riot,ashe test match currently interesting stupid congress rioting,1,
riot,people riot think usami san,1,
riot,football hooligan jail rioting game scotland ban match england uknews,1,uknews
riot,bbcnews ass british insurer say rioting cost police number reduce blind fat controller,1,
riot,live family live country looter shoot sight rioting tolerate,1,
rubbl,refuse let life reduce rubble shit keep pile shovel,0,
rubbl,china stock market crash gem rubble stock market crash su,0,
rubbl,nuclear arm race go rubble bounce winston churchill,0,
rubbl,stock market crash summer spark interest bargain hunt,1,
rubbl,parent impulsive remember come home room fill dust rubble want redesign,0,
rubbl,turn rubble disaster lego brick build house belong crazyideascollege,0,crazyideascollege
rubbl,china stock market crash gem rubble,0,360wisenews
rubbl,forbe china stock market crash gem rubble stock market crash summer ha,0,
rubbl,forbe europe china stock market crash gem rubble,1,forbe europe
rubbl,stock market crash summer spark interest bargain hunter bull bet rebound,0,
rubbl,refer main building hit rubble,1,
rubbl,jun yemeni search survivor rubble house old city follow,1,
rubbl,china stock market crash gem rubble forbesasia,1,forbesasia
rubbl,steve buscemi firefightr fame workd shift diggin wtc rubble lookg survivor,1,
rubbl,china stock market crash gem rubble tcot news,0,tcot p2 news
rubbl,china stock market crash gem rubble stock market crash summer,0,
rubbl,find diamond rubble,0,
rubbl,tnn china stock market crash gem rubble,1,tnn
rubbl,china stock market crash gem rubble roimentor yycwalk,1,roimentor yycwalk
rubbl,new post china stock market crash gem rubble,0,
rubbl,china stock market crash gem rubble stock market crash summer spark,0,
rubbl,photo postapocalypticflimflam prodding rubble,0,
ruin,damn suh let ruin year bruh year well start carpoole day,0,
ruin,ruin mood lose direction,0,
ruin,ruin,0,
ruin,quote let problem ruin faith,0,quote
ruin,anxious ppl watch meet make uncomfortable nt let ruin moment,0,
ruin,smoker ruin new car smell,0,
ruin,wait friend mta ruin sorrybutitstrue,0,mta sorrybutitstrue
ruin,sad red closing yuppie tourist ruin,0,
ruin,get ta ruin mood,0,
ruin,understand want hang guy friend space ruin trust,0,
ruin,earth want anybody unhappy purposely ruin somebody happiness,0,
ruin,fresh da shower lookss love new hair ruin brand yes,0,yes
ruin,tryna ruin life,0,
ruin,applaud terrific ruin,0,
ruin,thing ruin personal injury accident claim,1,
ruin,ruin holiday wordk zmne,0,
ruin,time good day ruin,0,
ruin,wanna ruin relationship ask intention,0,
ruin,ruin awful minion,0,minion
ruin,awful nt work artist ruin thing,0,
ruin,damn wale know ruin song,0,
ruin,play symphony play till finger bleed great masterpiece ruin,0,
ruin,family ruin actually go good,0,
ruin,hate awkward ruin thing,0,
ruin,long road ruin foo fighter,0,
ruin,ruin ruin sour cream brick cheese freezer dummy,0,
ruin,let asshole ruin night,0,
ruin,lol real issue way nfl try ruin guy legacy,0,
ruin,ruin day,0,
ruin,greedy bastard way ruin creativity censorship youtube,0,
ruin,gon na ruin game vanessa great player,0,
ruin,yes yes nt wanna ruin life lol,0,
ruin,wanna reboot fresh prince bel air bring original cast ruin,0,
ruin,happy fuck tryna ruin smile,0,
ruin,people let ruin life soul cervix odell definitely list,0,
ruin,ruin life,0,
ruin,babe gon na ruin let stay,0,
sandstorm,ok listen sandstorm,0,
sandstorm,watch airport swallow sandstorm minute,1,
sandstorm,nt turn sandstorm riot give good answer instead give dumb excuse new client,0,
sandstorm,like video darude sandstorm,0,
sandstorm,sandstorm jordan coat middle large refugee camp layer grit,1,
sandstorm,sandstorm woo hoo,1,
sandstorm,need friend booze darude sandstorm,0,
sandstorm,socialwot sandstorm engulfs caravan tent zaatari refugee camp,1,zaatari
sandstorm,hour sandstorm remixe merge song silence,0,
sandstorm,sandstorm,0,
sandstorm,come sandstorm tryout aug low woodland ms tryout hs tryout,1,
sandstorm,darude sandstorm,0,
sandstorm,listen darude sandstorm expect airhorn,0,
sandstorm,play darude sandstorm radio edit,0,
scream,slam phone ground scream ahahahga,0,
scream,scream world love little pony,0,
scream,update police nice people feel bad transform scream worry unconscious,0,
scream,gon na scream get lyric wrong lmao,0,
scream,scream sidjsjdjekdjskdjd nt stand,0,
scream,loki dagger pull jam mina thigh mina scream grab leg,1,
scream,omfg nt expect drag song pandora play omfg scream loud coworker scared,1,
scream,scream get microchip needle tbh cry needle massive ya haram,0,
scream,hear steven universe theme song upstairs scream song scare cousin,0,
scream,scream hit tweet,0,
scream,girl scream fuck chonce cryibg,0,
scream,think loud goal scream higuain offside goal germany,0,
scream,run earbud realize mean probably politely hi jared scream,0,
scream,got scream ask dad half step,0,
scream,dead ass scream sign fucking believe,0,
scream,stop believe come radio restaurant lil white bit scream mommys song,0,
scream,brooke face time concert scream minute straight,0,
scream,want tweet dislike today femnism movement want scream,0,
scream,people scream right ear week camp day leave,0,cedarglade2015
scream,kid go leadership camp come work today ask bathroom inner asb kid scream lot miss camp,0,
scream,vacation update great aunt kill spider bare hand scream fear fierce,1,fierce
scream,want cheat feel good vent twitter txt scream lol,0,
scream,sorry wild show wwa niall start singe steal girl literally scream shut fuck,0,
scream,scream language good,0,
scream,scream end oamsgajagahahah laighign otrametlife,0,otrametlife
scream,scream loud,0,
scream,scream chonce,0,
scream,scream lung say guy come promise,0,addtexastonext1dtour
scream,scream,0,
scream,literally walk concert scream soul bless,0,
scream,scream fuck hond,0,
scream,nt remember slsp happen remember wtf light turn scream encore,0,
scream,love wake dad scream,0,
scream,quiet literally hear phandom scream tyler tweet,0,
scream,scream fangirle oh god,0,
scream,drag night scream shell mannequin instead shell man think hate,0,
scream,internally externally scream,1,
scream,cue jariana stan scream,0,
scream,internally scream,0,
scream,time go swim basically scream smell taste bad,0,
scream,lhh silent scream master,0,
scream,hot sing scream,0,
scream,fine baby scream tv,0,
scream,harshness follow well day sarah race thought scream siren pace forth,0,
scream,favs scream fucking loud,0,
scream,camila follow spree tonight scream happiness,0,
scream,sorry scream car kinda know people let yell,0,
scream,dad scream coach give vocal chord workout field funnydadcoach,0,funnydadcoach
scream,people know kendall jenner time instagram follower gd scream lmao,0,
scream,scream baby love,0,
scream,scream omg idol wdym,0,idol 22days wdym
scream,hear scream,0,
scream,fucking scream,0,
scream,love scream,0,
scream,hey lonely girl tell friend way get scream,0,
scream,nochilllukehamming scream,1,nochilllukehamming
scream,follow town advertise youtube channel scream walk sign pls,0,
scream,scream favourite,0,
scream,scream different language,0,
scream,scream hell yes ahhhh omg,0,
scream,little boy well sit ass stop scream mother stop pull hair cry year old grow tf,0,
scream,omgggg scream,0,
scream,ooooohshit ooohshit scream hell love,0,
scream,phone scream jaileen cake phone look,0,
scream,scream internally,0,
scream,go ram ass hard shove face pillow muffle scream pain,0,
scream,come downstairs try look normal possible mom rhiannon scream hungover huh uhmmmm,0,
scream,hit tailor fucking double play kay scream rob hit,0,
scream,apparently face scream emotionally attach cheat,0,
scream,scare animatronic,0,
scream,get battlefield scream mic cunt,0,
scream,echo,0,
scream,bts song jimin scream,0,
scream,casually phone jasmine cry scream spider,0,
scream,update rly life scream vibrate nt handle,0,
scream,scream get face saku genital,0,
scream,home need watch scream,0,
scream,light recent event scream year,0,
scream,follow contain scream joy thankyou,0,thankyou
scream,dell tablet scream,0,
scream,feel sorry piece meat nice guy people need rush scream face,1,
scream,agree certain cultural appropriation thing honestly look house scream appropriation bc buddha,1,
scream,looney tune blake griffin commercial scream make space jam,0,
scream,scream oh wait school ok ok,0,
scream,aw man apollo crew scream think black guy quick mash,0,
scream,sleep scream,0,
scream,concert scream ear look wanna loose hearing anytime soon,1,
scream,obama support,0,
scream,little girl see spot light sky scream mom look angel sky,1,
scream,aaaa ok lemme roomr hear gay ass scream,0,
scream,scream mother,0,
seismic,oil gas exploration,1,
seismic,man read list famous musician oppose nuclear power wow powerful evidence know lot seismic risk,0,
seismic,seismic risk comparison case study calabria malta,1,
seismic,well learn derivative formula seismic think thing thing haha,0,
seismic,exploration take seismic shift gabon somalia,1,gabon somalia
seismic,oil gas organization real time insight cyber threat ey help,0,oil gas cyber ey
seismic,exploration take seismic shift gabon somalia worldoil subscription somalia,0,? somalia
seismic,alabamaquake seismic summary earthquake news history,1,earthquake news
seismic,seismic apple tv service stream channel,0,
seismic,zar cringe blow let marek use seismic toss,0,
seismic,seismic audio padded black speaker cover qty pair,0,
seismic,sismo detectado report okinawa island region depth km maximum seismic intensity jst,1,sismo japì_n ?
seismic,use perforate metal shear panel sfor seismic resistant application,0,
seismic,report ibaraki prefecture off depth km maximum seismic intensity earthquake,1,earthquake
seismic,thank benson clegg follow check map,0,follow map
seismic,thursday update kml seismic exploration vessel offshore oil,0,kml seismic offshore oil
seismic,oil gas exploration take seismic shift gabon somalia bloomberg somalia,1,? somalia
seismic,control future india yor subject exploration seismic maintenance electrical mechanical,0,
seismic,agency seek comment seismic permit,0,
seismic,plan worry get cover plenty seismic ipa seismic squeeze radler help,0,
seismic,oilandgas exploration take seismic shift gabon somalia,1,oilandgas gabon somalia
seismic,new post major challenge channel sale enablement,0,
seismic,panoramic resource cut job seismic event,1,
seismic,england east coast dogger bank westward seismic survey progress western regent towing metre long cable,0,
seismic,subcontractor work french seismic survey group cgg kidnap cairo hold islamic state company say,1,
seismic,art world seismic shift oddball observer,0,
seismic,sismo detectado miyagi estimate seismic intensity jst,1,sismo japì_n ?
sinkhol,sinkhole selfie wo nt believe brooklyn sinkhole sinkhole selfie wo nt belie,0,
sinkhol,mrw sinkhole open beneath friend gif funny lol comedy ifunny video image,1,gif funny lol comedy ifunny video image rt
sinkhol,talk goz fantastic interesting fact far manually buy domain sinkhole seek co op,0,
sinkhol,surprise anymore sure come,0,
sinkhol,large sinkhole swallow entire pond lownde county georgia large,1,occasion2b
sinkhol,water main break disrupt trolley service,1,
sinkhol,sinkhole close falmer drive bethlehem township,1,
sinkhol,sinkhole grow brooklyn meter crater swallow street,1,
sinkhol,scream mad scientist decease tumble heel fall sinkhole investigation,0,
sinkhol,gape sinkhole open brooklyn new york,1,
sinkhol,morning fdny respond sinkhole brooklyn unit remain scene,1,fdny brooklyn
sinkhol,foot sinkhole open lownde county residential area minute ago,1,
sinkhol,large sinkhole swallow entire pond lownde county georgia yonew,1,yonew
sinkhol,try write theological short story monster live sinkhole hear brooklyn accidentalprophecy,0,accidentalprophecy
sinkhol,sinkhole selfie wo nt believe brooklyn sinkhole,0,
sinkhol,load stuff go recently blog sinkhole pile,0,sinkhole pile
sinkhol,foot sinkhole open lownde county residential area,1,
sinkhol,sandiego news sinkhole disrupt downtown trolley service incident happen algeria,1,sandiego news algeria ?
sinkhol,beforeitsnew sinkhole grow brooklyn meter crater swallow street,1,
sinkhol,massive sinkhole emerge brooklyn,1,
sinkhol,lomasvisto thousand hipster fear lose giant sinkhole devour brooklyn intersectio cadenadeseguidore,1,lomasvisto cadenadeseguidore
sinkhol,sinkhole disrupt downtown trolley service sandiego,1,sandiego
sinkhol,sinkhole swallow brooklyn intersection video,1,
sinkhol,die fall sinkhole blame,0,
sinkhol,damn sinkhole sunset,1,
sinkhol,water main break disrupt trolley service sandiego,1,sandiego
sinkhol,possible sinkhole disrupt trolley service depression portion asphalt downtown,1,
sinkhol,sinkhole selfie wo nt believe brooklyn sinkhole sinkhole sel funny,0,funny
sinkhol,evansville resident tell limit water usage sinkhole construction evansville resident,1,
sinkhol,sinkhole swallow taco place neighborhood,0,
sinkhol,sinkhole west damage car,1,
sinkhol,georgia sinkhole close road swallow pond,1,
sinkhol,sewer look sink happen pre sinkhole go insane,0,
sinkhol,sinkhole leak sewage open housing estate irish aug,1,
sinkhol,random hole break street,0,
sinkhol,mtsalert orange blue line rider expect delay downtown sinkhole develop vicinity street,1,mtsalert
sinkhol,sinkhole brooklyn,1,
sinkhol,share large sinkhole swallow entire pond lownde county georgia yonew,1,yonew
sink,feel sink low self image quiz,0,
sink,year afloat pension plan start sink,1,
sink,feel sink unhappiness quiz,0,
sink,sink music video tv career brooke hogan thank dad free publicity doubt help,0,
sink,feel bad literally feel feeling heart sink bc ugh jfc,0,
sink,nowplaye sink fast north east unsigned radio listen,0,nowplaye
sink,horrible sinking feeling home phone realise time,1,
sink,nigga car sinking snap fox priority,0,priority
sink,delete abbandoned sink darsena castello scaligero di sirmione,0,
sink,equipment ego break dig family internet hoke except versus sink term dfljev,1,
sink,currency transgress payday prison ward sinking fund payment unsecured loan jbumzqpk,0,
sink,lose sink stone carry onnnn,0,
sink,lie clinton sink donald trump singing let america great,0,
sink,slow report sink boat mediterranean sea shame,1,
sink,walk plank sink ship,0,
sink,sink ship scarlet lane lenore replace stone saison,0,
sink,movie titanic jack rise stay wooden beam sink,0,
sink,lose sink stone carry,0,
sink,chance gander sink ship tna help appease morbid curiosity destinationimpact,0,tna destinationimpact
sink,happy exercise demon price keep rise service keep sink goodbye,0,goodbye
sink,investment news keurig green mountain inc quarter earning share sink hour stock,0,
sink,lloyds london insure bet sink twin,0,sink twin
sink,sink slipper put boot,0,
sink,eye hope know sink sink away turn,0,
sink,sink dark dream deep cold pain inside love dan bear jota esse,0,
sink,sink carb consultative assembly plan subconscious self live straight leading way escape xkdrx,0,
sink,lara like sink tooth flesh claw arm,0,
sink,spend hour sink wonderfully create world mafia mafia ii life excited installment,0,
sink,sink episode heart hurt bad,0,
sink,slowly sink waste,0,
sink,tribe keep sink everyday fast year titanic disaster,1,tribe
sink,time try end sink,0,
siren,weird high pitch noise hear siren ofnsixjks,0,
siren,today corii siren birthday spoil wishlist,0,wishlist
siren,haha jam imeshika hapa garden city mat bumper bumper aar decide chill piga siren kijan,0,
siren,oh shit,0,
siren,big love nm,0,
siren,amateur night actress reprise role siren horror,1,horror
siren,lol cousin course cause di maria lol,0,
siren,fuck,0,
siren,healing revive game well attack siren gt character new girl,0,
siren,demoness voice angel siren beckon void,0,
siren,whelen model siren amplifier police emergency vehicle read ebay,0,
siren,good time day åê liveonstreamate,0,liveonstreamate
siren,nowplaye song siren john frusciante,0,nowplaye
siren,get oh finally jennifer aniston got marry happy,0,
siren,super sweet beautiful,0,
siren,apparently go siren announce sure fun dull bc siren monotonous sound,0,
siren,weird siren go hope hunterston process blow smithereen,1,
siren,intend wait wind drop siren go signal allow leave go,1,
siren,internet firm subject new cybersecurity rule eu,0,
siren,think forgive angelina jolie sef,0,
siren,course cause di maria lol,0,
siren,add video playlist siren gameplay walkthrough,0,
siren,jealous bc want elgato hd bday record video nt money,0,askh3cz
siren,look co happy bn oh finally jennifer aniston got marry happy,0,
siren,beautiful aquarius queenmy siren cliff pretense sing phantom songfor shall,0,
siren,pharma overload loud cry emergency siren fucking,0,
siren,pc account got hack try pull buck nsf idea,0,
siren,argue cheap well,0,
siren,real question tornado siren go dyersburg,1,
siren,save save save heavydirtysoul,0,
siren,siren test complete test conclude,0,
siren,serephina siren,0,
siren,thank join foot,0,
siren,outdoor siren test pm fgcu siren test pm today message send test conclude,0,
siren,mean fan need girl sound damn siren,1,
siren,hate damn milwaukee indyfest car sound long tornado siren go wake nap,0,
siren,new game come soon,0,
siren,screech siren accompany walk,0,
siren,cop seriously turn siren traffic turn right wtf,0,
siren,know music good hear siren chill,0,
siren,reason go warped today tony play issue show sleep siren play attila issue issue issue,1,
siren,thu aug utc millcityio theramin siren,1,millcityio 20150613
siren,block hear story kid get lemonade life minute talk semi pay,0,
siren,segment anthology series get feature film treatment,0,
siren,siren tell ready turn,0,
siren,fuck sleep siren,0,
siren,dad say look thin usual,1,
siren,rapper stop sample police siren start sample whale song,0,
siren,yay siren,0,
siren,ouvindo sleep siren awn,0,
siren,sirensicebreaker fantasy work diverse heroine think read,0,sirensicebreaker
siren,see bomb squad car head north elliott siren word head,1,
siren,know dill pickle taste,0,
siren,marketforce perth name winner siren round iinet nbn buffer cat shark radio spot,0,
siren,idea go hear siren damn helo fly low apt shake,1,
siren,let goooooooo,0,
siren,new favorite midfield general disco siren house edm version soni soner soundcloud,0,soundcloud
siren,photoset hakogaku åêi kurd bear battlefield raise battlefield gunfire siren,1,
siren,siren cancel,0,
siren,look niggas follow siren,0,
siren,go hollywood helicopter siren hometownglory,0,abc7eyewitness hometownglory
siren,connor franta damn siren hope okay dan howell murder street,1,
siren,gostei de um de sleep siren postcard polaroid acoustic cover,0,
siren,rocket moon sleep siren rocket moon,0,
siren,win siren round radio news,0,radio news
siren,add video playlist cher lloyd siren,0,
siren,sleep siren vai vir pra sp,0,
siren,kyle people expect sleep siren,0,
siren,run siren half hour hotel premium promotion offer,0,
smoke,wrong lil smoke good conversation,0,
smoke,smoke brooo,0,
smoke,barely smoke people solo blunt,0,
smoke,smoke get,0,
smoke,smoke weed snoop lion ft collie buddz,0,
smoke,girl smoke notice start lose alot weight hmmm know body want thin girl tf,0,
smoke,smoke baby lie baby laugh baby want simple thing,0,
smoke,gon na naked smoke cigarette radneck hot,0,
smoke,smoke alot weed fuck kidney dutch,0,
smoke,pipe peanut butter pipe smoke peanut butter,0,
smoke,want smoke,0,
smoke,smoke crqck becyme mayor include foursquare,0,
smoke,burp smoke come,0,
smoke,date let smoke leave date smoke trust,0,
smoke,niggas sell weed smoke stay high nigga way,0,
smoke,wanna drink little smoke little,0,
smoke,smoke ave street hot youngin,0,
smoke,know smoke way taxi bus come light cigarette smoke wait,1,
smoke,lionel train smoke locomotive magne traction instruction,0,
smoke,smoke blunt ciggs,0,
smoke,smoke toooooo lmao scared text number bck make sense lol,0,
smoke,tryna smoke mf,0,
smoke,trynna smoke tj hoe,0,
smoke,sky look clear smoke fire enjoy time tahoe favorite place,1,
smoke,austin smoke agree lol,0,
smoke,smoke,0,
smoke,smoke shit peace,1,
smoke,wanna smoke cig problem breath smell old ash tray fucking disgusting,0,
smoke,smoke dk go lol,0,
smoke,smoke eat sleep,0,
smoke,miss josie cause wanna smoke splif taco bell,0,
smoke,mental twitter note sure smoke alarm battery snuff time face twitter reminder change battery,0,
smoke,mean mino say smoke mention,0,
smoke,wanna smoke weed comma,0,
snowstorm,snowstorm oil canvas art painting,0,art painting
snowstorm,manuel hope early buffalo snowstorm accuracy improve,1,
snowstorm,hi poem call snowstorm meet space time rain thx ur watch disney chann,0,
snowstorm,reason knock door snowstorm wear footed pajama good way bathroom,0,
snowstorm,sorry build fire desk maintain snowstorm til arrive,0,
snowstorm,sassy city girl country hunk strand smoky mountain snowstorm aom ibooklove bookboost,1,aom ibooklove bookboost
snowstorm,wo let follow,0,
snowstorm,new photo oak snowstorm take winter southdown hampshire photography art tree treeporn,1,photo winter southdown hampshire photography art tree treeporn
snowstorm,snowstorm purified darkest fairy tale pale moonlight,0,
snowstorm,mini lalaloopsy doll seed sunburst june seashore sweater snowstorm autumn spice,0,
snowstorm,bring game past snowstorm tic tac toe battleship fast food matchwood,1,
snowstorm,get snowstorm hailstorm,1,
snowstorm,list reason london tubestrike well snowstorm read,0,tubestrike
snowstorm,ahh hate snow lol snowstorm,1,growingupincoloradoû
snowstorm,nasty thunderstorm snowstorm nah,0,
snowstorm,cool freddie jackson sippin milkshake snowstorm,0,
snowstorm,transportation panel show video pileup wheeler snowstorm wy crash crash crash amssummer,1,amssummer
snowstorm,ah remember day snowstorm,1,
snowstorm,pick man bar snowstorm know come inch stay,0,
snowstorm,nowplaye smoke snowstorm benjamin francis leftwich hopefully new album come soon,0,nowplaye
snowstorm,new photo oak snowstorm southdown hampshire winter photography art tree treescape treeporn,0,photo southdown hampshire winter photography art tree treescape treeporn
snowstorm,like video boee takeoff snowstorm hd cockpit view atc audio episode,1,
snowstorm,photo mothernaturenetwork thundersnow hear thunder snowstorm extremely uncommon,1,
snowstorm,lakeeffect snowstorm twill denim jacket proceed item design,1,lakeeffect snowstorm
snowstorm,lrt refer lyric hear big boi explain cool milkshake snowstorm lame bar effective time,0,
snowstorm,actually currently dress snowstorm despite middle texas summer thank office,1,
snowstorm,snowstorm plan outside rome st mary major tonight annual occasion artificial snow remembering summer snow ad spot,0,rome
storm,finally storm,0,
storm,gamefeed warcraft inspire mode likely hit hero storm let beginning videogame,0,gamefeed videogame
storm,typhoon soudelor capture incredible nasa photo way taiwan,1,
storm,storm come cool,1,
storm,omfg wake,0,
storm,new ebay uk star war storm trooper pop vinyl bobble head figure pop funko,0,
storm,prepare property storm,1,property storm
storm,kesabaran membuahkan hasil indah pada saat tepat life wait storm pass learn dance rain,1,
storm,comeeeee bout storm tho,1,
storm,person dance rain likely walk storm,0,
storm,secret storm vortex lightning catcher book,0,
