keyword,text,target,hashtags
crash,crash helmet silvery floor karnal fat shoot sample pbcanpcx,0,
crash,crash test trailer paul scheer rob huebel comedy special record,0,
crash,try download crash tutorial,0,
crash,maj muzzamil pilot offr crash near mansehra today,1,
crash,bin laden family plane crash avoid microlight landi peritoengrafoscopia,1,peritoengrafoscopia
crash,son sleep night finally lay bed crash,0,
crash,knobhead bin laden family plane crash avoid microlight landing,1,
crash,bin laden family plane crash avoid microlight land far runway member,1,
crash,ux fail emv people want insert remove quickly gas pump stripe reader person tell crash pos,1,
crash,major hamayun shaheed pilot heli crash mansehra,1,
crash,uk bin laden family plane crash avoid microlight land far runway member,1,uk
crash,crash time past couple hour,0,
crash,gt bin laden family plane crash avoid microlight land far runway rochdale heywood,1,rochdale heywood
crash,ipod crash weloveyoulouis mtvhott direction,1,weloveyoulouis mtvhott
crash,hear day ago drive near crash car laugh,0,
crash,havnt crash,0,
crash,tell crash take long time,0,windows10
crash,answer,1,
crash,pak army helicopter crash mansehra,1,
crash,bug crash euro,1,
crash,pakistan say army helicopter crash country restive northwest killing,1,
crash,news bin laden family plane crash avoid microlight land far runway,1,news
crash,guy buy car tuesday police knock door yday cos crash run text ask send log book,1,
crash,maj muzzamil pilot offr crash near mansehra today almighty strength family bear loss,1,
crash,thief break window hicksville store steal cell phone fled crash,0,
crash,army source person board include team doctor die helicopter crash near mansehra weather cause crash,1,
crash,skype crash host,0,
crash,phone update phone crash restore let restore,0,
crash,fast overtook twice crash tru luv,0,
crash,nearly crash car type paul rudd attack fly ant note phone,0,
crash,honestly nightmarish god drive new place stressful shit hate ugh crash time,0,
crash,crash car parked car day modestmouseremix truestory,0,modestmouseremix truestory
crash,pakistan say army helicopter crash country restive northwest fox news,1,
crash,ttw today news bin laden family plane crash avoid microlight land far runway,1,
crash,hear skh radio time crash car,1,skh
crash,intact lift odd plane glide crash sea,1,
crush,love husband post man man crush monday lol,0,
crush,womem crush wednesday,0,
crush,bf gf crush,1,
crush,guy idk woman crush,0,
crush,wce lie tho stand crush,0,
crush,woman crush,0,
crush,woman crush wedneday go beautiful loveyouuuu aintsheperty,0,loveyouuuu aintsheperty
crush,bestfriend high school crush,0,
crush,ina bute girl crush,1,
crush,crush,0,
crush,love love love remember crush,0,
crush,minute overrated experience smh,0,
crush,que justin bieber,0,
crush,lil brother crush mariah,0,
crush,ron fez dave high school crush,1,
crush,girlfriend completely gorgeous woman crush stuff,0,
crush,high moe bouta crush friday,0,
crush,big crush nt know know,0,
crush,mrrobinson give thesteveharveyshow vibe music teacher look student crush girl go high school,0,mrrobinson thesteveharveyshow
crush,seriously big girl crush blake lively,0,
crush,crush stand vine,0,
crush,yhngsjlg tweet secret crush,0,
crush,yeah crush,0,
crush,try look cute wen crush pass,0,
crush,crush content marketingåêmediocrity,0,
crush,crush girl high school realize lol,0,
crush,sevenfigz crush,1,
crush,man crush fucking day,0,
crush,tiffanyfrizzell crush,0,
crush,crush wce,0,
crush,lmao know ve crush sooo,0,
crush,nowplaying fitz tantrum league crush listen nowplaye,0,nowplaying crush listen nowplaye
crush,man crush everyday,0,
crush,love love ai playa crush lot,0,
crush,kenny holland crush da vida,0,
crush,popeyes bout crush,0,
crush,crush holy shit,0,
crush,bhavana mom crush soul,0,
crush,wrapup cable tv company share crush disney disappoint,0,
crush,crush squirrel bone mortar pestle school bio dept sure worstsummerjob,0,worstsummerjob
crush,edwin wow crush,0,
crush,mango juice crushed,0,
crush,man crush death car,1,
crush,diamond piece charcoal handle stress exceptionally hard press,1,
crush,wow crush edwe bluejay,0,edwe bluejay
crush,crush gym crush butterfinger flurry clearly priority straight,0,
crush,question crush ortiz bunting sport write forefather crush william,0,
crush,ouch clelli hear hope dream crush,0,
crush,jesus christ ball fucking crush bluejay,0,bluejay
crush,crush km run pace sportwatch gps nikeplus,0,nikeplus
crush,papi absolutely crush ball,0,
crush,crush mile run tonight awesome,0,
crush,oil price fall driver reap benefit,0,
crush,nick william hit bomb crush,0,
crush,holy moly crush,1,
crush,ayekoradio play brasswork agency crush shake radio netlabel electronicmusic listen ccmusic,0,ayekoradio radio netlabel electronicmusic listen ccmusic
crush,youtube commenter say dothraki crush come westero nah bro underestimate dothraki,1,
crush,disillusioned lead character check happy lucky free spirit girl check dream life crush check great music check crowe trope intact,0,
crush,remember nora jone crush week notice,0,
crush,empire avenue crush soul,0,
crush,chapoutier crozes hermitage purple violet slate crush gravel white pepper yum france wine dc,0,france wine dc
curfew,thirst curfew,0,
curfew,ara news reporting jan fighter infiltrate ashrafiyah district afrin aim carry suicide attack ypg impose curfew,1,
curfew,fact curfew,0,
curfew,shut freshman past ur curfew need sleep spend ur time watch tv instead go outside,0,
curfew,night curfew campus find,0,
curfew,police teenager arrest curfew violation evanston ride steal bicycle teenager take cus chicago news,1,chicago news
curfew,reason listen curfew overtime stick kodak,0,
curfew,give curfew,0,
curfew,curfew help think bc,0,bc
curfew,exofficio man boxer brief curfew large,0,
curfew,info wnd cld exp inst apch rwy curfew oper taxiway foxtrot foxtrot navbl tmp,0,
curfew,thank city wide curfew,0,
curfew,say curfew nope,0,
curfew,curfew start right private class end tutor woman preferably,0,
curfew,curfew,0,
curfew,past curfew grove,0,
curfew,mom say home curfew,1,
curfew,say month curfew time smfh,0,
curfew,ball curfew,0,
curfew,see turn blind eye bloke drinking smoke curfew time worth hassle,1,
curfew,free school obligation family good damn curfew,1,
curfew,know say final goodbye grandpa see news rip open idea ve curfew,0,
curfew,people have curfew graduate high school,0,
curfew,tell mom past curfew oth,0,
curfew,cancel cat doctor appointment decide play come home curfew,0,
curfew,info curfew oper taxiway foxtrot foxtrot navbl wnd exp inst apch rwy damp tmp qnh,0,
curfew,lie pay old car curfew freedom donthate,0,freedom donthate
curfew,info cld exp inst apch rwy curfew oper taxiway foxtrot foxtrot navbl tmp wnd,0,
curfew,rite man tlk widout nuh curfew long aka cum fi steal di itz rubbery di dem fi knw sound music,0,
curfew,nt come worry curfew,0,bc19
curfew,get curfew,0,
curfew,hour late curfew pray dog bark unlock door,0,
curfew,da judge give dis girl pm curfew,0,
curfew,beginning summer mom curfew wonder home,0,
curfew,charlie lim start pm sunday curfew leh,0,
curfew,bomb try home curfew,0,
cyclon,awwww baby walter rewatchingthepilot teamscorpion cyclone,0,rewatchingthepilot teamscorpion cyclone
cyclon,big annual football medium day cyclone hoop recruit nugget,1,
cyclon,camera art photography new boltåêcyclone dr dual outlet power packåêfor external camera flash,0,camera art photography 0215
cyclon,work purpose large cyclone well,0,
cyclon,new tropical cyclone form near guam form call molave,1,
cyclon,video new de jhaustin thoma cyclone ame tribune ame tribune video new de jhaustin thomas,0,
cyclon,need plant pacific cyclone season help,1,
cyclon,bbc force retract false claim cyclone pam,1,
cyclon,great condition easton cyclone softball bat fastpitch,1,
cyclon,severe weather bulletin typhoon soudelor tropical cyclone warn issue pm,1,
cyclon,cyclone derive power calm center person norman vincent peale,1,
cyclon,ante hudhud cyclone chandrababu valle ne ante ga,1,
cyclon,cyclone koman devastate family myanmar week need help today,1,
cyclon,severe weather bulletin tropical cyclone warning typhoon hanna issue thursday august,1,6
cyclon,future vanuatu cyclone pam encourage traditional way living,1,vanuatu
cyclon,bank manager ask tom interview cyclone tom loan give purchase bicycle,0,
cyclon,excited cyclone football,0,
cyclon,talent misdirection cyclone pass ignite pass vanish drive phantom shoot kurokobot,1,kurokobot
cyclon,comdev asia radio station bangladesh broadcasting program address upcoming cyclone koman,1,comdev asia bangladesh program koman
cyclon,cyclone imperialism spin globe militarism crush people suck blood,1,
cyclon,mercury cyclone gt hood mould nice core cobra jet gt,0,
cyclon,cyclone passion overblown,0,
cyclon,majesty emperor salman khan unstoppable cyclone entertainment humanity bajrangi bhaijaan create history crose cr,0,
cyclon,mercury cyclone gt quarter panel rear trim moulding cobra jet,1,
cyclon,tropical cyclone info soudelor maximum wind speed maximum wind gust speed,1,
cyclon,ask cyclone sama read jail fate rindou,0,
cyclon,drug alcohol jackson vroman house,0,
cyclon,blend old new vanuatu prepare future emergency,0,vanuatu
cyclon,wfp wfp deliver food bangladesh flood victim tropical cyclone koman dhaka unite na,1,
cyclon,rohingya house kyee nockthie hamlet taungbazar region buthidaung severely damage cyclone,1,rohingya kyee
cyclon,cyclone double cherry outfit ootd doubleghat,0,ootd doubleghat
damag,probably allow ascend damage max value,0,
damag,drop nigga damage,0,
damag,union supportive london prepared damage economically time,0,
damag,like video gta online collateral damage gta online pc,0,
damag,fyi accident property limestone,1,
damag,fitness knee damage solution,0,fitness
damag,complain phoenix mode fire emblem turn ray gigant difficulty option damage,0,
damag,wha kid damage,0,
damag,clear accident property damage eb ny,1,ny35
damag,crazy phone damage person,0,
damag,get pretty windy damage,0,
damag,reuse advanced life equipment transit drum champaign damage fdbdp,0,
damag,carful spot damage time check time give away baggage loss wy,0,
damag,storm damage report west tennessee,1,
damag,hey royal love damage out,1,royal
damag,arachy piece deal weapon damage,1,
damag,mage fairy tail specialize property damage natsu dragneel,0,
damag,yeah fast extremely high damage want fast gon na,1,
damag,saw fast af great damage upgrade shitton exclusively playthrough,0,
damag,let tree fall fence know homeowner insurance help,0,
damag,tor tor situation wind damage enhanced wording key imo,1,
damag,happen hear runway lighting damage contractor,1,
damag,nda write damage ability offer service future prolly want work,0,
damag,crosse line time field wide attack instant kill damage,1,
damag,np metallica damage inc,0,np
damag,inmate charge cause damage calgary remand centre riot,1,
damag,pt cross sectarian protest powerful shia cleric say militia fightin isis wo nt forget damage uve ur ppl,1,pt
damag,homeowner insurance cover water damage good thing know,1,
damag,beach damage shit,1,
damag,cross arm cover hand anymore damage hello,0,
damag,new post blog thesensualeye model cam damage toronto apr nsfw pussy ass boob asian nude,0,nsfw pussy ass boob asian nude û
damag,report hit run roadway property damage statesville rd,1,
damag,devil cry special edition vergil vs agnus window mission dmd damage leedstraif,0,
damag,glaucoma occur fluid build pressure inside eye level damage optic nerve eyefact,1,glaucoma eye eyefact
damag,jsunnews storm damage report madison county thunderstorm damage report ar,1,jsunnews
damag,puncture wound foreign body left index finger damage nail initial encounter,1,icd10
damag,thank word warning queenswharf brisbane,0,queenswharf brisbane
damag,real shit damage bitch,0,
damag,lmao fuckboy change damage control,0,
damag,standard damage control,1,
damag,say superficial wound pepper spray damage,1,
danger,dad wo chase constantly time frequently great deal danger distraction,0,
danger,believe shirt company animal danger well start see change wildlife,0,
danger,danger union bear,0,
danger,sign open fall danger release day blast review tour sign,1,
danger,check rockin preview danger zone come soon artistsunite,0,rockin artistsunite
danger,red flag warning fire danger dry thunderstorm bay area weather cawx,1,weather cawx
danger,danger,1,
danger,tree cut fish eat stream poison realize,0,
danger,away preservation park imposition danger african people imagine,0,
danger,indian govt medium concern safety danger,1,
danger,training grain wheat bare gold august heat anger trespass lest seek danger,0,
danger,fettilootch slanglucci oppression great danger come soon album yd,0,fettilootch slanglucci
danger,appear govt lose ethical moral relevance mean usa population danger,0,govt ethical usa
danger,head slide especially home danger,0,danger
danger,permit bear hunting danger outnumber actual bear license florida fir st petersburg,0,st
danger,look repair recent bad rap nonprofit partnership,0,nonprofit
danger,wish victoria secret good,0,
danger,arsenal fan want west ham relegation battle season danger afc sun,0,afc
danger,danger excitement underwater cave diving,0,
danger,girl wanna save danger health try somebody wanna somebody,0,
danger,gun protection shit life danger,0,
danger,thirsty danger dehydration,1,
danger,thunderstorm little rain expect central california high fire danger weather cawx,1,weather cawx
danger,wanna danger day tattoo bad cool spider look someone wrist smth,0,
danger,experience angry critical pundit grave danger go rail,0,
danger,danger skyler danger,0,
danger,dangerous ok rest danger tb,0,
danger,investigate robert mueller respond complaint nov leave son danger,0,
danger,honestly tho modibo maiga steal live fuck past good danger fucktard coyi,1,coyi
danger,fear way make danger contemplate logic situation find courage engage,0,
dead,joel book act,0,
dead,dead afghanistan aircraft crash afghan military helicopter crash remote region,1,
dead,awesome norse landscape load atmosphere life bore dead snotgreen wasteland,0,
dead,miss long hair dead anyways hair,0,
dead,argsuppose pre bear attain individl courtof law forbid kill dead person,0,
dead,remember time goku give life dead birb hell goku,0,
dead,naaa bee dead legit zombie feel sore body,0,
dead,happen road right bus dead,0,
dead,lmfao fucking luis hhahaha dead,0,
dead,watch emmerdale nd know slightly attractive man name ross got beat nd dead,1,
dead,need confirm ross dead cause nt trust yh,0,
dead,iwasdisappointedby telltale walk dead good character real gameplay performance issue,0,iwasdisappointedby
dead,beforeitsnew hundred fear dead libyan migrant boat capsize rescue,1,
dead,war come waved white flag end dead wo nt mislead,0,
dead,oh fuck sake dead,0,
dead,ross dead askcharley,0,askcharley
dead,don avoid wear dead black flame red stark white esp debate blue gold brown shoe,0,
dead,perspective grateful dead critical writing contribution study,1,
dead,hello look mod cold ice see site link download dead maybe share thank,0,
dead,hard ny new trend babalmao welcome nyozi,0,
dead,say dead die,0,
dead,ross dead noooooooooooo,0,
dead,thinking time friend bail nite dead go great time free dance row,0,
dead,typhoon soudelor take dead aim taiwan,1,
dead,askcharley emmerdale emotional ross dead,0,askcharley emmerdale
dead,man find dead demi moore swimming pool,1,
dead,val dead sue,1,
dead,dead,0,
dead,wyrmwood road dead fucking awesome awesome ending awesome,0,
dead,believe ross dead emmerdale summerfate,0,emmerdale summerfate
death,text nigga bff boyfriend love boy death niggas hold attention,0,
death,hate talk otp grandma mean love death talk damn ssshhheeesshh,0,
death,death forever rep jet,1,
death,vibrator shape vape bust,0,
death,death threat nigga life gon,0,
death,adult die plague colorado,1,
death,xbox pro console red ring death read ebay,0,
death,go gainesville death,1,
death,year later ferguson see change ask real,0,
death,papiichampoo enjoy obama era civility prez say gop support iranian death,0,papiichampoo
death,feel death,0,
death,like video dj hazard death sport,0,
death,tell cousin wanna hang text say come honestly death wish,0,
death,rss judge order texas recognize spouse sex death certificate,0,
death,loyalty mission involve kick shitty nobleman death love elven weirdo,0,
death,way seemeth right unto man end thereof way death,1,
death,thank narrowly avert death fun right,1,
death,katherine death,0,
death,death muslim,1,
death,go starve death,0,
death,te cruz bash obama comparison gop iranian shout death america,0,
death,new crime know right punishable death,0,
death,issue upload death smoochy awakening clip reason bicentennial man pain ass,0,
death,te cruz bash obama comparison gop iranian shout death america tcot,1,tcot
death,cyprus news analysis mullah omar death split taliban rank omar demise certainly lead,1,cyprus
death,feel death holy molys,0,
death,video slay mexican journalist unknowingly predict death,0,
death,old lady rockin death metal sedan downtown smoke cigarette find real mom,0,
death,afghan peace talk doubt mullah omar death financial time mullah,0,mullah
death,pusssssssssy shoook death,0,
death,trial death cecilthelion postpone,0,cecilthelion
death,year ago week anniversary marilyn monroe death ripriprip,0,
death,ari hint snippet death,0,
death,tomorrow death,0,
death,new nyc legionnaire disease death toll rise follow,1,follow
death,vaxshill death measle complication yrs loose shit dead legionnaire month cricket,1,vaxshill
death,bigamist wife charge death pregnant wife child mother nephew,0,
death,south huge wreck airlift maybe death interstate completely block,1,
death,case voter fraud year need new law gun death day actually follow law amirite,1,vra50û
death,silence palermo shipwreck child death,1,palermo shipwreck child death
death,bsf jawan die fidayeen ak bloody insa insa rifle blame soldier death mod,1,insa
death,breast milk original superfood rate worldwide stall contribute child death year,0,superfood
death,death red light running crash pedestrian bicyclist vehicle occupant hit red light runner,1,
death,death year physician error avoid,1,physician
death,cdcwhistleblower death measle complication yrs loose shit dead legionnaire month cricket,1,cdcwhistleblower
death,bigamist wife charge death pregnant wife child news,0,news
death,death year foodborne illness dear,1,
death,hear talk avoid thousand resistant infection death yrs adiossuperbacteria,0,adiossuperbacteria
death,irony die death,0,
death,lol usually objective maybe uncle ben course death end business usual,0,
death,comment death old child datum tell nghlth,1,we nghlth
death,death,1,
death,know happen govt think belief warrant death innocent jap,1,
death,real magic real life woman go miss ohio town focus fbi probe strange death,1,
death,case constitute epidemic plague health publichealth,1,plague health publichealth
death,lunch stewart julian couple hour early good finally find happen,0,
death,weyburn police warn public fentanyl death province,1,
death,annoying crusty life matter head ass people actually support cause hate black death attention,0,
death,time reduce gun death,1,
death,stat high auto death apply child vehicle guess run lightrail well adult,0,
death,cancer equate death blackpool kowe sign save life beclearoncancer,1,blackpool beclearoncancer
death,reverse situation lol know civilian death specifically utilize political,1,
death,hear death murder chrissie kill adam val finn die emmerdale,0,emmerdale
death,die horrible death trap ship know risk,1,
death,fco minister condemn attack mosque saudi arabia result death,1,
death,critter climate plague death colorado,1,
death,year angela sander bear roundhouse kick related death increase percent,1,
death,walmart take step child safe hot vehicle look innovative car seat,0,
death,beluga death report seaworld average age year opseaworld,1,seaworld opseaworld
death,bigamist wife charge death pregnant wife child mothe,1,
death,pls reduce cyclist death compulsory highway code test vehicle use road notrocketscience,1,notrocketscience
debri,aerospace exec plane debris miss aircraft wing find reunion island th,1,aerospace exec
debri,malaysia airline flight disappear ago debris find south indian ocean,1,
debri,aircraft debris find la reunion miss malaysia airline,1,? ? ? ?
debri,discover plane debris miss malaysia airline flight time,1,
debri,confirm debris,1,
debri,malaysia confirm plane debris wash reunion island flight,1,
debri,missing debris float rì union new york time,1,
debri,rì union debris surely flight official new york time,1,
debri,debris find reunion island flight mystery plane disappearance well novel,1,mh370
debri,reuter debris confirm relative hope discovery crash site,1,
debri,nbcnightlynew malaysian official debris find reunion island billneelynbc report,1,mh370
debri,debris find reunion island sad tragedy innocent crash,1,sad tragedy innocent crash mh370
debri,love food fun malaysian prime minister najib razak confirm aircraft debris find rì union isla,1,love food fun
debri,malaysia certain france plane debris miss,1,
debri,malaysian official debris find reunion island report,1,mh370
debri,debris find reunion island come malaysian pm,1,
debri,aircraft debris find island malaysia confirm,1,
debri,irony debris flight find reunion island,1,
debri,aircraft debris find la reunion miss malaysia airline abc online,1,
debri,reunion debris miss malaysia flight,1,
debri,expert leave lab malaysia confirm debris,1,mh370
debri,kamindoz reuter debris confirm relative hope discovery crash,1,kamindoz reuter
debri,plane debris discover reunion island belong flight malaysian pm,1,
debri,debris confirm relative hope discovery crash site malaysian official confirm breakth,1,
debri,abc aircraft debris find la reunion miss malaysia airline abc onlinea piece aircraft debris,1,
debri,malaysia confirm reunion island debris,1,
debri,debris confirm relative hope discovery crash site video,1,video
debri,plane debris miss,1,
debri,aircraft debris find la reunion miss malaysia airline abc onlin malaysia news,1,malaysia news
debri,interesting aircraft debris find la reunion miss malaysia airline abc,1,
debri,aircraft debris confirm nation star online,1,
delug,ah awash abstract dustpig tweet explain deluge,0,
delug,bet mother nature plan send deluge way,0,
delug,feed deluge twice week fantastic,0,
delug,welcome organize twitter find important stuff deluge btw love music sign ep,0,
delug,niagara fall package deal deluge tour yyeso,0,
delug,apologise sincerely inevitable deluge gbbo tweet come wo hold grudge decide unfollow bake cake,0,gbbo bake cake
delug,deluge resource flood medical provider cleanup worker,1,flood
delug,towboat trek sympathy deluge fall vtc,1,
delug,deluge eulogy cecilthelion whatsapp torment soul matias xavier,0,cecilthelion
delug,wa smile july deluge west australian,0,
delug,china delay deluge fundamental economy support valuation stock,0,
delug,despite deluge fantasticfour notice man buy ticket bloody minded,0,fantasticfour
delug,photo forrestmankin colorado camping,0,
delug,deluge trois riviere hour legionstrackandfield,0,legionstrackandfield
delug,half naked man twitter tonight normally embrace odd torso scale tonight deluge unprecedented,0,
delug,yes man have bad week far event deluge favs turn right,0,
delug,good window torrent client recommend deluge look write year ago java swing use bad,0,
delug,pre dynastic king legendary period deluge dumuzid shepherd,0,king deluge dumuzid
delug,deluge hell vine,0,
delug,strange encaustic cerography portion till voice deluge byityf,0,
delug,beach deluge surf camp motion surf therapy programme kick today,1,
delug,light rain forecast base dressing light rain incessant deluge,0,
delug,historic apply deluge recently expose childsexabuse truly historic scale cover,1,childsexabuse
delug,bible back truck unload descriptive deluge indecency explain,0,bible
delug,audio business owner share differently,0,
delug,slew update post come hosting fix unfml deluge,0,unfml deluge
delug,photo boyhaus heaven send jakeåê warm morning madison river early evening,0,
delug,thing gishwhe got soak deluge go pad tampon thx,0,gishwhe
delug,deluge awesome word idea,0,
delug,wrinkle face deluge decay,0,
delug,thank teach online class ask student lot question sorry deluge ren art,0,
delug,shadowman save big easy deluge supernatural monstrosity read free,0,
delug,crap content marketing deluge dougkessler slideshare contentmarkete,0,b2b b2bagency contentmarkete
delug,love song healing deluge sing church spanish translate,0,
delug,vince mcmahon billionaire remember read deluge post vince mcmahon lose,0,
delug,nfl play deflategate perfectly deluge incremental story bore world care want away,0,
delug,search powerful content improve business frustrate deluge,1,
delug,miss exhibitor email value assnchat,0,asae15 assnchat
delug,meditationbymsg ppl get method meditation deluge divine blessing happy peaceful life,0,meditationbymsg
delug,uk deluge canadian theme top timing perfect believe mad,1,
delug,tomorrow internet day month look forward deluge stuff avoid downright lie,0,
delug,novalismi joseph mallord william turner shade darkness evening deluge clicca sul titolo,0,novalismi
delug,get ton telemarketing call cell phone deluge,0,
delug,sure shop deluge local child want buy,0,
delug,susinesse deluge invoice stlnd colour shape likely rise pay pile,0,
delug,glimpse hyderabad deluge heavy rainfall,1,glimpse
delug,business deluge invoice stand colo shape lzkely rise pay pile,0,
delug,matter week amazon go deluge poorly write indie dystopian fiction teen escape blood farm,0,
delug,business deluge invoice stand colour shape likely ris togthe pay pile,0,
delug,business abe deluge invoice stand colour shape likely rise,0,
delug,deluged low self image quiz,1,
