keyword,text,target,hashtags
ablaz,wholesale market ablaze,1,
ablaz,try bring heavy metal,0,metal rt
ablaz,africanbaze break news nigeria flag set ablaze aba,1,africanbaze
ablaz,cry set ablaze,0,
ablaz,plus look sky night ablaze,0,
ablaz,mufc build hype new acquisition doubt set epl ablaze season,0,mufc
ablaz,inec office abia set ablaze,1,
ablaz,barbado bridgetown jamaica car set ablaze santa cruz head st elizabeth police superintende,1,bridgetown
ablaz,ablaze lord,0,
ablaz,check nsfw,0,nsfw
ablaz,outside ablaze alive dead inside,0,
ablaz,awesome time visit cfc head office ancop site ablaze thank tita vida take care,0,
ablaz,soooo pump ablaze,0,
ablaz,want set chicago ablaze preaching hotel,0,
ablaz,gain follower week know stat grow,0,
ablaz,west burn thousand wildfire ablaze california,1,
ablaz,build perfect tracklist life leave street ablaze,0,
ablaz,night retainer weird well wear single night year,0,
ablaz,deputy man shoot brighton home set ablaze,1,
ablaz,man wife year jail set ablaze niece,1,
ablaz,santa cruz head st elizabeth police superintendent lanford salmon,0,
ablaz,police arsonist deliberately set black church north carolinaåêablaze,1,
ablaz,noche el bestia happy teammate train hard goodnight gunner,0,
ablaz,kurd trample turkman flag later set ablaze vandalize office turkman diyala,1,kurd diyala
ablaz,truck ablaze voortrekker ave outside tambo intl cargo section,1,
ablaz,set heart ablaze city gift skyline kiss lip,0,
ablaz,sky ablaze tonight los angele expect ig fb fill sunset shot know peep,0,
ablaz,west burn thousand wildfire ablaze california climate energy,1,california climate energy
ablaz,revel wmv video mean mac farewell ablaze wmv en route dvd gtxrwm,0,
ablaz,progressive greeting month student set pen ablaze torch publication,0,
ablaz,rene ablaze jacinta secret fallen sky edit mar,0,
ablaz,steve fire california tinderbox clown set hood ablaze,1,
ablaz,nowplaying rene ablaze ian buff magnitude edm,0,nowplaying edm
ablaz,huge fire wholesale market ablaze,1,
ablaz,time talk know work,0,
accid,kid cuz get bicycle accident split testicle impossible kid michael father,0,
accid,accident nashvilletraffic traffic move slow usual,1,nashvilletraffic
accid,accident center lane block santaclara nb great america pkwy bayarea traffic,1,santaclara bayarea traffic
accid,personalinjury accident summer read advice solicitor help otleyhour,0,personalinjury solicitor otleyhour
accid,stlouis caraccidentlawyer speed cause teen accident car accident,0,stlouis caraccidentlawyer
accid,report motor vehicle accident curry herman rd near stephenson involve overturn vehicle use,1,
accid,bigrigradio live accident awareness,1,
accid,mile marker south mooresville iredell vehicle accident ramp close pm,1,
accid,sleep pill double risk car accident,0,
accid,accident know gon happen,0,
accid,traffic accident cabrillo hwy magellan av mir,1,
accid,mile marker south mooresville iredell vehicle accident congestion pm,1,
accid,pastor scene accident owner range rover,1,
accid,mom home fast wish mom accident truck spilt mayonnaise,0,
accid,horrible car accident past sunday finally able thank god,1,
accid,wait pissed donnie tell accident,0,
accid,truckcrash overturn fortworth interstate click,1,truckcrash fortworth
accid,accident ashville sb sr traffic,1,ashville traffic
accid,carolina accident motorcyclist die crash car cross median motorcycle rider travel,1,
accid,fyi cad fyi accident property piner rd horndale dr,1,
accid,naayf accident year turn chandanee magu near mma taxi ram halfway turn,1,
accid,accident leave lane block manchester nb eddy rd stop traffic delay min traffic,1,manchester traffic
accid,accident property damage piner rd horndale dr,1,
accid,accident,0,
accid,fyi cad fyi accident property st,1,
accid,pm traffic accident injury willi foreman rd,1,
accid,aashiqui actress anu aggarwal near fatal accident,1,
accid,suffield alberta accident,1,
accid,mile backup south accident block right lane exit langtree rd consider nc nc nc alternate,1,
accid,accident change life help determine option financially support life care plan go treatment,0,
accid,break deadly motorcycle car accident happen hagerstown today detail whag,1,break hagerstown whag
accid,marinade accident,0,
accid,car week get fucking car accident mfs fucking drive,1,
accid,bahrain police previously die road accident kill explosion,1,bahrain
accid,hear church leader kenya come forward comment accident issue disciplinary,0,
aftershock,scuf ps live game cya,0,
aftershock,man drive effort get painful man win roger bannister,0,
aftershock,ir icemoon aftershock dubstep trapmusic dnb edm dance,0,dubstep trapmusic dnb edm dance icesû
aftershock,victory bargain basement price dwight david eisenhower,0,
aftershock,remember come charles schulz,0,
aftershock,speak scuf people end get ps,0,
aftershock,hard conflict glorious triumph thomas paine,0,
aftershock,growingupspoile go clay pigeon shoot cry aftershock,0,growingupspoile
aftershock,guess actually want free aftershock tc,0,
aftershock,aftershock terrifying good roller coaster disclaimer,0,
aftershock,aftershock,0,
aftershock,see issue aftershock,0,
aftershock,wisdomwe bonus minute daily habit improve life lifehack,0,wisdomwe lifehack
aftershock,aftershock protect profit global financial meltdown david wiedemer http,0,
aftershock,moment scary roller coaster guy scream bloody murder silverwood aftershock,0,silverwood aftershock
aftershock,aftershock streaming youtube,0,
aftershock,aftershock protect profit global financial book,0,# book
aftershock,face difficulty wrong right joel osteen,0,
aftershock,thing stand dream try belief actually possible joel brown,0,
aftershock,praise god ministry tell wdyouth biblestudy,0,now wdyouth biblestudy
aftershock,remember go die good way know avoid trap think lose steve job,0,
aftershock,try orange aftershock today life,0,
aftershock,love bb,0,
aftershock,aftershock school kick great want thank make possible great night,0,
aftershock,people interrupt george bernard shaw,0,
aftershock,man get oyster man get shell andrew carnegie,0,
aftershock,need tonight play hybrid slayer eu hmu,0,
airplan accid,expert france begin examine airplane debris find reunion island french air accident expert news,1,news
airplan accid,strict liability context airplane accident pilot error common component aviation cr,1,
airplan accid,lifetime odd die airplane accident,0,
airplan accid,expert france begin examine airplane debris find reunion island french air accident expert wedn,1,
airplan accid,awwww airplane accident gon na die cutie good job,1,
airplan accid,family member osama bin laden die airplane accident ironic mhmmm gov shit suspect,1,
airplan accid,man go airplane engine accident,1,
airplan accid,horrible accident man die wing airplane,1,
airplan accid,cessna airplane accident ocampo coahuila mexico july kill man include state coahuila government official,1,
airplan accid,horrible accident man die wing airplane watchthevideo,1,horrible accident watchthevideo
airplan accid,expert france begin examine airplane debris find reunion island french air accident expert,1,
airplan accid,expert france begin examine airplane debris find reunion island french air accident expert wednesday begin examine,1,
airplan accid,kca mbataweel rip binladen family member kill airplane accident,1,kca votejkt48id rip binladen
airplan accid,send coworker nude accident thank god airplane mode,0,
airplan accid,kill airplane accident night car wreck politic good,0,
airplan accid,expert france begin examine airplane debris find reunion island french air accident expert mlb,1,mlb
airplan accid,unbelievably insane man airport airplane aircraft aeroplane runway accident,1,man airport airplane aircraft aeroplane runway accident freakyû
airplan accid,horrible accident man die wing,1,
airplan accid,usama bin ladin family dead airplane crash naturally accident,1,
airplan accid,pilot die plane crash car festival crash aircraft airplane pilot death accident carf,1,crash aircraft airplane pilot death accident carf
airplan accid,strict liability context airplane accident,1,
airplan accid,dtn brazil expert france begin examine airplane debris find reunion island french air accident exp,1,
airplan accid,horrible accident man die wing wtf believe eye,1,
airplan accid,nicole fletcher victim crashed airplane time ago accident leave little bit trauma,1,
airplan accid,omg horrible accident man die wing airplane,1,
airplan accid,omg believe rip bro airplane accident jetengine turbojet boe,1,omg rip airplane accident jetengine turbojet boe g90
airplan accid,airplane accident,1,
airplan accid,phone look car ship airplane accident terrible,0,
airplan accid,statistically risk getting kill cop die airplane accident,0,
airplan accid,airplane crash house colombia people die accident,1,
airplan accid,shooting airplane accident,1,
airplan accid,drone cause airplane accident pilot worried use drone esp close vicinity airport,1,
ambul,early wake sister beg come ride ambulance hospital rodkiai,1,rodkiai
ambul,fear kill pakistani air ambulance helicopter crash,1,
ambul,air ambulance scene crash car lorry,1,emsneû
ambul,fear kill pakistani air ambulance helicopter crash reuter yugvani,1,yugvani
ambul,lead emergency service boss welcome new ambulance charity,0,
ambul,travel aberystwyth shrewsbury right incident service halt outside shrew ambulance scene,1,
ambul,ambulance sprinter automatic frontline vehicle choice lez compliant ebay,0,
ambul,new nanotech device able target destroy blood clot,0,
ambul,hella crazy fight ambulance couple mosh pit,1,
ambul,run ambulance lucky justsaye randomthought,0,justsaye randomthought
ambul,news fear kill pakistani air ambulance helicopter crash dna,1,news til_now dna
ambul,wait ambulance,0,
ambul,ok need ambulance hahahah good,0,
ambul,pakistan air ambulance helicopter crash kill,1,
ambul,nissan ok need medical assistance ambulance need,0,
ambul,ny emts petition hour em paramedics ambulance,0,em paramedics ambulance
ambul,check parking lot say year ambulance st johns,0,
ambul,know way ambulance come,1,
ambul,reuter fear kill pakistani air ambulance helicopter crash,1,reuter
ambul,ambulance right outside work,0,
ambul,dog think ambulance,0,
ambul,happen hatzolah em ambulance respond dual siren,0,
ambul,fear kill pakistani air ambulance helicopter crash worldnew,1,worldnew
ambul,police ambulance number lesotho body know,0,
ambul,surprised standardise clinical practice nhs ambulance trust,0,
ambul,people try walk ambulance pass hate,0,
annihil,episode trunk annihilate freiza clean shit show nigga mercy,0,
annihil,shall annihilate petebest dessicate lay bare shall kneel,0,
annihil,uribe annihilate baseball met,0,met
annihil,annihilate previous meeting improvement,0,
annihil,mizzou annihilate florida past season end muschamp career compete bama,0,
annihil,annihilate ab,1,
annihil,annihilate status education mba behalf easy street careen eovm,0,
annihil,luka die annihilate alois trancy,0,
annihil,good un fella sorry wo annihilate,0,
annihil,cop pull drunk driver safety second car hit train,1,
annihil,annihilate,0,
annihil,boom country entirely annihilate britain,0,
annihil,annihilate thank,0,
annihil,thing sure god promise israel annihilate horror iran nuke,0,
annihil,guess ok armenian spend history getting annihilate,1,
annihil,year annihilate people instantly aware ability annihilate humanity,1,
annihil,day tryout go good minus fact stop quickly short ball annihilate toenail injury,0,
annihil,oryx symbol arabian peninsula annihilate hunter,1,
annihil,ready annihilate bucs game,1,
annihil,people annihilate night weather philip think forecast,1,
annihil,domain sophistication annihilate closely minute feat zrnf,0,
annihil,see judas priest rob come scorpion support fucking annihilate place astonishing gig,0,
annihil,officially skip hashtag getting annihilate review bummer,0,fantasticfour/#fant4stic
annihil,explain annihilate case survivor evolve godlike,1,
annihil,completely annihilate cech paul keegan time alive,0,
annihil,annihilate legion survivor imperfect hybrid project quickly form new secret cell,0,
annihil,exactly lesnar cena match summerslam year great brock annihilate guy,0,
annihil,annihilate damascus syrian army grind gang manure pile,1,
annihil,ok completely forthright food coma bc kebab tahini pickle annihilate fry,0,
annihil,fun fill happy hour simmon bar camden handsome got annihilate apart game,0,
annihil,juanny beisbol sr annihilate ball lgm,0,lgm
annihil,hell fraction belief total annihilation destruction usa,1,
annihil,maybe israel tell sorry pre sell river annihilation,0,
annihil,evildead annihilation civilization,0,
annihil,national park service tonto national forest stop annihilation salt river wild horse,0,
annihil,annihilate quarterstaff annihilation,1,
annihil,world annihilation vs self transformation alien attack exterminate human,0,
annihil,starmade stardate planetary annihilation,1,
annihil,sign share petition save wild horse arizona,0,
annihil,check salt river horse help stop annihilation happen thx,0,
annihil,soul punish withåêannihilation,0,
annihil,mention major contributor annihilation israel,1,
annihil,need help horse sign stand voice,1,gilbert23
annihil,reject law misguided false prophet imprison nation fuel self annihilation,0,
annihil,annihilation jeb christie kasich hour away god allow day,0,
annihil,need help horse die sign petition stand voice,0,gilbert23
annihil,hey az sign petition save wildhorse tantonationalforest sing long order,0,az wildhorse tantonationalforest
annihil,stop annihilation salt river wild horse,1,
annihil,current nova bookslast check tie book rider die annihilation,0,
annihil,sign save saltriverwildhorse,0,saltriverwildhorse
annihil,thank dante join follow zone johnny,0,
apocalyps,gon na fight taylor soon,0,
apocalyps,ohh fukurodani survive apocalypse bokuto feel horrible poor boy ppor child,1,
apocalyps,jocelyn birthday apocalypse,0,
apocalyps,stephenscifi adaptation watch charlie human apocalypse optione film sciencefiction,0,sciencefiction
apocalyps,apocalypse,0,
apocalyps,hour august red rover zombie apocalypse internetradio,1,internetradio collegeradiû
apocalyps,feel pull stage apocalypse,0,
apocalyps,kinda hot play radio today disease apocalypse start careful,0,
apocalyps,apocalypse lol gf,0,
apocalyps,know question interpretation sign apocalypse call,1,
apocalyps,julie apocalypse version romeo juliet warmbodie,0,warmbodie
apocalyps,fittscott night lucky block mod bob apocalypse wither mod showcase popularmmos,0,
apocalyps,begin day snow apocalypse,1,
apocalyps,short reading apocalypse spirit angel take enormous high mountain,0,
apocalyps,candylit imagine sarumi zombie apocalypse fight heart heart conversation,0,
apocalyps,like youtube video minecraft night lucky block mod bob apocalypse wither,0,
apocalyps,planet lone audience apocalypse,0,
apocalyps,dad buy dvd look science doc read actually impending biblical apocalypse,1,
apocalyps,apocalypse come week know,0,
apocalyps,look grizzly peak right look beginning dystopian apocalypse movie,0,
apocalyps,niece ask scared apocalypse,0,
apocalyps,storm cairo late man apocalypse set photo,1,
apocalyps,night lucky block mod bob apocalypse wither mod showcase popularmmos,0,
apocalyps,shoot heart xv go totally love bad heart pierc,0,
apocalyps,pm gmt hesse play dark soul day etcpb,0,etcpb
apocalyps,know zombie,0,
apocalyps,late reveal storm queen apocalypse,1,storm apocalypse
apocalyps,shadow box apocalypse,1,
apocalyps,enjoy live action attack titan time poster remind freshly clean coif apocalypse,0,
apocalyps,like video minecraft night lucky block mod bob apocalypse wither mod showcase,0,
armageddon,pbban avysss kill flag fast xp reason,0,pbban
armageddon,pbban kill flag fast xp reason,0,pbban
armageddon,official vid doublecup prod armageddon,0,doublecup armageddon
armageddon,ouvindo peace love armageddon,0,
armageddon,good movie see armageddon,0,
armageddon,bed time wake revolution armageddon start,0,
armageddon,red faction armageddon microsoft xbox read ebay,0,
armageddon,know shit go world series armageddon,0,
armageddon,love truelove romance lith voodoo seduction astrology rtrrt lotz apocalypse armageddon,0,love truelove romance voodoo seduction astrology rtrrt lotz apocalypse armageddon 1008plaû
armageddon,gon na beat armageddon hsu hao get flawless try,0,
armageddon,ben affleck know wife kid girl help love armageddon eonlinechat,0,eonlinechat
armageddon,long coat hand wear certainty armageddon bear sense occasion,0,
armageddon,phone spy hide door nsa data mining software financial armageddon blog,0,
armageddon,pbban fighterdena kill flag fast xp reason,0,pbban
armageddon,photo sketch base taste armageddon episode startrek tos,0,startrek tos
armageddon,armageddon,1,
armageddon,good luck tomorrow night coefficient point plz,0,
armageddon,history book thank justice department way pay income tax,0,
armageddon,vladimir putin issue major warning late escape armageddon,1,
armageddon,god kingdom heavenly rule people earth armageddon,0,
armageddon,entertainment lot brucewilli movie dvd die hard monkey armageddon ebay auction,0,entertainment brucewilli dvd ebay auction
armageddon,talk goof guild saunder come right stage,0,
armageddon,niece gain ability stand getting prepare toddler apocalypse armageddon,0,
armageddon,check prepper doomsday library collection cd shtf preppertalk survival prepper,0,prepper doomsday shtf preppertalk survival 2a prepper
armageddon,eep thought yesterday see hella scary hail armageddon,1,armageddon
armageddon,ahamedi think messiah come year ago armageddon dajaal gog magog,0,
armageddon,sadly window reveal microsoft ethic armageddon,0,
armageddon,armageddon avert el patron ultimalucha,0,ultimalucha
armageddon,time hour late series blueprint armageddon extremely impressive,0,
armageddon,european fitba till christmas armageddon,0,
armageddon,christian unite israel cufi jew convert soon die armageddon,0,christian israel cufi we
armageddon,official vid gt doublecup prod armageddon,0,doublecup armageddon
armageddon,tomorrow day start armageddon preseasonworkout,0,preseasonworkout
armageddon,lee comedy work class tory prepare armageddon,0,interestrateriseû
armageddon,chart prove financial crisis begin financial armageddon economic collapse blog track tren,0,
armageddon,paul craig robert vladimir putin issue major warning late escape bric robert russia,1,bric robert russia
armageddon,stage right light funny goofball staff pd,0,
armageddon,official vid thereal armageddon comin soon,0,thereal armageddon
armageddon,celtic finger cross aberdeen tomorrow night armageddon eh,0,
armi,beyonce pick fan army beyhive,0,beyhive
armi,direction pick fan army directioner,0,directioner
armi,second summer pick fan army,0,5sosfam
armi,pick fan army beyhive,0,beyhive
armi,see army whitewalker thing slightly intrigue get far,0,
armi,build kingdom lead army victory start friend code lzktjnox,0,
armi,salvation army host rally reconnect father child salvation army host school,1,
armi,vote directioner vs queen round fanarmyfaceoff,0,directioner queen fanarmyfaceoff
armi,build army dog leader lion dog fight lion,1,
armi,hero tv review,0,
armi,infantry men lume dial army analog quartz wrist watch sport blue nylon fabric,0,
armi,victorinox swiss army date woman rubber mop watch,1,
armi,indiakomuntorjawabdo indian army,0,indiakomuntorjawabdo
armi,da mtvsummerstar videoveranomtv mtvhott britney spear lana del rey,0,mtvsummerstar videoveranomtv mtvhott
armi,stony jackson america hope lead army felon army reject army satan,0,
armi,wwi wwii japanese army navy military japan leather watch war mido read ebay,0,
armi,potus appoint brig gen richard kaiser member mississippi river commission learn mrc,0,
armi,violent country army involve help control killing bring peace poor people,1,
arson,jewish terrorist charge historic church arson ugly truth,0,
arson,spokane authority struggle solve arson case today hamilton,1,
arson,thousand attend rally organize peace protest arson attack take life,1,
arson,add familia arson squad,0,
arson,fake hate crime lesbian burn house new,1,
arson,los angele time arson suspect link fire catch northern newsintweet,1,newsintweet
arson,mourning notice stab arson victim stir israel,1,
arson,sound arson,0,
arson,owner chicago area gay bar admit arson scheme lgbt,0,lgbt
arson,wait,0,
arson,arson suspect link fire catch northern california,1,
arson,trial date set man charge arson burglary,1,
arson,death palestinian toddler arson attack israel crack jewish,1,
arson,palestinian teen kill amid protest arson attack,1,
arson,kisii police kisii hunt student fail arson plot police kisii hunt student countynew,1,kisii countynew
arson,mariah get thick shoulder poor girl,1,
arson,mourning notice stab arson victim stir israel poster shira banki,0,
arson,relaxinpr miprv latime arson suspect link fire catch northern california,1,
arson,jewish leader pray hospital palestinian family treat arson,1,
arson,angel arson,0,
arson,tennessee lesbian couple fake hate crime destroy home lesbian,1,lesbian
arson,arson suspect link fire catch northern california los angele time,1,
arsonist,hate white people mo,1,
arsonist,nowplaye arsonist mc impressed,0,nowplaye
arsonist,allege east bay serial arsonist arrest,1,
arsonist,minor citation possesion decriminalize substance face time,0,
arsonist,suspect serial arsonist arrest calif,1,
arsonist,legal system forget,0,
arsonist,dick,0,
arsonist,bloor ossington arsonist burn mattress northumberland st cbcto,0,cbcto
arsonist,arsonist,0,
arsonist,nice come sit,0,
arsonist,vegetarian vegan video show arsonist torch popular bk restaurant strictly vegetarian govegan uniteblue,0,vegetarian vegan govegan uniteblue
arsonist,arsonist arrest set fire watch headline nightbeat,1,arsonist headline nightbeat 2minutemix
arsonist,video capture man remove american flag long beach home burn arsonist seek,0,
arsonist,trick think nasty thing,0,
arsonist,spotlight paradise arsonist mc wniagospel,0,spotlight wniagospel
arsonist,make,0,
arsonist,town salem melt ice cube bc arsonist,0,
arsonist,arsonist blame blaze plastic recycling business adelaide report,0,7newsadl
arsonist,hotboy shit,0,
arsonist,zodiac girl feat trey dupree produce sparkz beatz chuck da arsonist,0,
arsonist,lmfao,0,
arsonist,allege east bay serial arsonist arrest sanfrancisco,1,sanfrancisco
arsonist,jokin nt,0,
arsonist,guess shit think,0,
arsonist,arsonist set nyc vegetarian restaurant fire police newyork,1,newyork
arsonist,like video town salem win arsonist,0,
arsonist,crack cuz,0,
arsonist,smoke good fuck eat drink drive nice car wear green mink,0,
arsonist,kill get court day earl,0,
arsonist,lmao real live,0,
arsonist,owner chicago area gay bar admit arson scheme frank elliott plead guilty hire arsonist,0,
arsonist,trust iran stop terrorism invite arsonist join fire brigade telegraph,0,
arsonist,big burn true story arsonist miss girl,1,
attack,stay vigilent civil liberty constant attack nativehuman myreligion,1,nativehuman myreligion
attack,credit inspire rediscover fantabulous tbt,0,tbt
attack,nashville theater attack gun grabber demand,1,
attack,break terror attack police post udhampur,1,udhampur
attack,demi stan think heart attack sell copy,0,
attack,scare new version nuclear attack warning know government prepare,1,
attack,isil claim suicide bombing saudi mosque kill kb,1,
attack,funniest twitter feminist try attack,0,
attack,horrific attack wife muslim italy liveleak news,1,news
attack,blast accuse yeda yakub die karachi heart attack mumbai,1,mumbai
attack,drone attack kill suspect militant north waziristan,1,
attack,suspect late theater attack psychological issue,1,
attack,militant attack police post udhampur spos injure livemint allthenew,1,allthenew
attack,break obama official give muslim terrorist weapon texas attack,1,
attack,delhi government provide free treatment acid attack victim private hospital,1,
attack,new post new smb relay attack steal user credential internet,1,
attack,israeli force raid home allege car attack suspect palestine,1,palestine
attack,heart attack think goat dead worry rocket okay,0,
attack,gon na lie kinda ready attack senior year,0,
attack,leave hand diamond graveyard shift attack defend right handside fucking idiot,0,
attack,volleyball attack ii volleyball training machine set simulation,1,volleyball
attack,notley tactful direct response harper attack alberta hell yeah premier ableg cdnpoli,1,ableg cdnpoli
attack,police assailant late movie theatre attack homeless psychological issue,1,
attack,thank damn heart attack,0,
attack,suspect late theatre attack psychological issue,1,
attack,india shud evidence share terrorist use oth contrie,1,
attack,illegal alien release obama dhs time charge rape murder santa maria woman prior offense,1,
attack,strongly condemn attack ary news team karachi cowardly act simply try job,1,
attack,fact atomic bomb call little boy fat man say lot mentality go attack,1,
attack,ignoranceshe latinoand benothe morebut attack dog hate group gop,0,
attack,heart disease prevention secondhand smoke,0,
attack,dayton area org tell hit cyber attack,1,
attack,attack titan game ps vita yay wait,0,
attack,infowar nashville theater attack gun grabber demand nwo,1,nwo
attack,anxiety attack,0,
attack,dog attack food pugprob,0,pugprob
attack,cop injure gunfight militant attack udhampur police post suspect militant attack police post,1,
attack,ask feel attack julie ask frail,0,
attack,feel attack,0,
attack,black man way white man black man getting attack,0,
attack,nt believe fucking cis female go claim offend transgendered female attack medium,0,
attack,israeli helicopter attack civilian gaza complete exercise greece,1,
attack,christian attack muslim temple mount wave israeli flag pamela geller,1,
attack,pt unit attack responsible target muslim scholar imprison youth,1,pt
attack,telnet attack streamyx home southern,1,
