keyword,text,target,hashtags
eyewit,eyewitness medium actively embrace uk audience read report impact ugc news,0,eyewitness uk ugc
eyewit,read eyewitness account hiroshima day life,1,hiroshima life
eyewit,interesting approach replace eyewitness video ferguson case video,1,
eyewit,climatechange eyewitness extreme weather social medium post crazy thing anarchy,1,climatechange anarchy
eyewit,hamburg police chief gregory wickett tell eyewitness news confirm deny investigation underway,0,
eyewit,like video mini pony pack punch live report salem county fair eyewitness,0,
eyewit,lone survivor eyewitness account operation redwing lose hero seal,1,
eyewit,civil right movement eyewitness history series wexler sanford hardcover,0,
eyewit,affect people hiroshima eyewitness testimonial,1,
eyewit,read eyewitness account hiroshima,1,
eyewit,wftv eyewitness news tn school psychologist arrest florida child porn charge,0,
eyewit,wake kern county eyewitness news morning air right kbak liveonkbak,1,liveonkbak
eyewit,anniversary hiroshima bombing illustrate timeline bombing eyewitness account particularly horrify,1,
eyewit,aug radio article eyewitness account abortion organ harvesting plan parenthood,0,
eyewit,dk eyewitness travel guide denmark travel guide ebay auction eye,0,
eyewit,patrickjbutler excellent damiengayle eyewitness account kid company closure drop bomb,1,
eyewit,monkey abuse notorious laboratory dealer peta eyewitness invest,0,
eyewit,true tbt eyewitness news wbre wyou,0,tbt
eyewit,dk eyewitness travel guide chicago dorle kindersley publishing travel book ebay auction,0,
eyewit,light stage load shed stage load shed force pm pm,0,
eyewit,wftv eyewitness news fbi man steal secret married honduran minor sex,0,
eyewit,free bokoharam captive speak sure go school,0,bokoharam
eyewit,try save mido macia murder accuse testify try save mido life,0,
famin,russian food crematoria provoke outrage amid crisis famine memory moscow reuter russian government,1,
famin,guy bitch ai famine,0,
famin,food crematoria provoke outrage amid crisis famine memory,1,
famin,russia food crematoria provoke outrage country soar poverty soviet famine memory,1,russia
famin,hunger hit function probably long famine god,0,
famin,accord gallup poll money likely suffer time famine,0,
famin,ppl unu feast today famine tomorrow,0,
famin,turn darkness king redeem queen serene famine wolf,0,
famin,russian food crematoria provoke outrage amid crisis famine memorie,1,
famin,example low food price cause farmer famine year mean simple capitalism fail feed,0,
famin,memorial million perish holodomor erect capital,1,
famin,export food wo nt solve problem african end famine poverty solve control tribal war,1,
famin,new article russian food crematoria provoke outrage amid crisis famine memory read,1,
famin,build muscle feast famine feed diet plan base lose weight,0,
famin,famine come end bluebell,1,bluebell
famin,taste feast famine starve trust jack iartg rwa rrbc,0,iartg rwa tw4rw rrbc
famin,russia destroy food people hungry one insane government,1,
famin,ethiopian regime continue receive foreign aid famine strike year eastern ethiopia,1,
famin,reuter russian food crematoria provoke outrage amid crisis famine memory,1,
famin,grade black horse score dynamix,0,dynamix
famin,russian provoke outrage amid crisis famineåêmemorie,1,
famin,bolshevik government monopolize food supply seize power hunhry population artificial famine result,1,
famin,experience smell rot potato time famine awful country smell,1,
famin,thing terrible great ethiopian famine,0,
famin,remind peasant destroy food stalin army come redistribute wealth cause famine death,1,
famin,update russian food crematoria provoke outrage amid crisis famine memory russian society recal,1,
famin,adventure mineness famine,1,9
famin,food crematoria russia provoke outrage amid crisis famine memory,1,
famin,robert conquest famine museum kiev,0,
famin,end time famine war death plague presence grow strong,0,
famin,maratha raider scorch land punjab refuse food aid famine wonder bengali harbor hard feeling,1,
famin,image famine hope christ blog happen forget god hopeinchrist,1,hopeinchrist
famin,squeeze tear famine plague tsunami chance lego blubber,0,
famin,russian food crematoria provoke outrage amid crisis famine memory yahoo news,1,
fatal,year old boy charge manslaughter toddler report year old boy charge manslaughter fatal sh,1,
fatal,roger goodell fatal mistake tom brady innocent man,0,
fatal,boy charge manslaughter shoot death elijah walker year old appear wednesday,1,
fatal,fatal attraction common common pain,0,
fatal,apd investigate fatal shooting year old child southeast anchorage,1,
fatal,investigator shift focus cause fatal waimate fire,1,
fatal,sorry,0,
fatal,police man early die shoot vermont st,1,
fatal,man accuse fatal hit run new judge,0,
fatal,winnipeg police seek witness arlington william fatal crash,1,
fatal,nearly fatal pee san francisco,0,
fatal,petition remaster fatal frame windwaker style selfie mode,0,
fatal,man charge fatal crash near dubbo refuse bail,1,
fatal,california man face manslaughter charge sunday wrong way fatal crash,1,
fatal,fatal flaw iran deal,0,
fatal,stockton police investigate fatal drive shoot north stockton,1,
fatal,deputy dog dispute lead fatal shooting person county gunfail nra,1,gunfail nra
fatal,cop illegal immigrant prior arrest charge fatal sex attack,1,
fatal,okay thank yes kindness fatal patrick stump level kindness,0,
fatal,success permanent failure fatal,0,
fatal,tell adopt way maybe overlook fatal whyor,0,
fatal,boy charge manslaughter shoot death elijah walker,1,
fatal,robert ballew log statement fatal level,0,
fatal,fatal attraction,0,
fatal,news crime police victim fatal crash close near franklin person justice court,1,news crime justice court
fatal,boy charge fatal shooting year old,1,
fatal,exclusive fatality involve duty nypd cop year,1,
fatal,nyc news legionnaire death toll rise new york city fatality old adult,1,nyc news
fatal,let fraction vital need fatality break education econom,0,education econom
fatal,las vegas city red light run fatality,0,
fatal,totally unprepared emp attack china russia probably isis possess fatality push,1,
fatal,city implore motorist speed report animal fatality near nature reserve,1,
fatal,say veg fruit good hope injury fatality,0,
fatal,understand fatality trap inside wholesale market fire engine fire fighter scene,1,
fatal,month mark total fatality half year,1,
fatal,hse release annual workplace facility datum look,0,hse
fatal,seattle deadly red light runner intersection reveal,1,seattle
fatal,reject mortal kombat fatality mortal kombat stretch boundary,0,
fatal,minor train leave rail major smithsonian interlock derail crash barrier wall fatality,1,
fatal,injury illness fatality late number,1,
fatal,osage beach release,0,
fatal,wonder cool weird look character mkx fatality skinless predator,0,
fatal,saudi arabia abha fatality report follow suicide bombing mosque avoid area,1,saudi abha
fatal,use road wisely prevent carnage continue let fatality holiday period ggindependencmessage,0,ggindependencmessage
fatal,mortal kombat fatality gross interesting,0,
fatal,ray mkx look fatality,0,
fatal,know fatality mortal kombat,0,
fatal,kitana fatality slay vine,1,
fatal,osp concerned mount fatality,1,
fatal,mortal kombat fatality meat predator,0,
fatal,estimate damage fatality hiroshima sized atomic bomb drop hometown,1,hiroshima70
fatal,rcmp report fatality injury result collision tch near whitbourne,1,
fatal,govt allocate bn flood action issue take centre stage fatality veneto,1,
fatal,spider bite relate fatality australia,0,
fatal,like video tremor joke tremor dlc fatality ray,1,
fatal,motordom lobby change language traffic fatality need future visionzero,0,visionzero
fatal,share help cousin family,0,
fatal,main factor pedestrian fatality people fail yield car,1,
fatal,mortal kombat excellent fatality fun mortal kombat sega version,0,
fatal,uber reduce drunk driving fatality say independent study,0,
fatal,like video mortal kombat pc gameplay fatality ray mkx,0,
fatal,rcmp confirm fatality vehicle crash tch remain close whitbourne accident,1,
fatal,american casualty include fatality japanese fatality,1,
fatal,uk train accident fatality year run despite increase passenger journey,1,
fatal,fail bring number road fatality immensely,0,
fatal,policylab public hearing nyc today tomorrow address child abuse neglect fatality,1,
fatal,yep consider million japanese fatality project downfall,1,
fatal,ship logistics enca fatality migrant boat capsize med hundred onboard capsize,1,ship logistics
fatal,message board display update traffic fatality new message begin today traffic death slow worker,1,
fatal,driver fatality irish road pedestrian cyclist risk,1,
fatal,jay big pun biggie wrap question fatality flawless victory,0,
fatal,cuddle right,0,
fatal,yo dm,1,
fatal,savage leak thoma brady gangstermail account wonder quick fatality samsung mobile real son,0,
fatal,like video sn vabengal zss sws fatality captain falcon,0,
fatal,hibernate pbx irrespective pitch fatality careerism pan crbzfz,0,
fatal,fatality,0,
fatal,die lyme disease case fatality rate nearly,1,
fatal,fatality corpse jittere,1,
fatal,wow fatality big rig hit motorcyclist blood wow sick,1,
fatal,nah hit homie wit fatality wit babality cold cold fuck lmfaoooo,0,
fatal,kosciusko police investigate pedestrian fatality hit train thursday,1,
fatal,yes life fatality rate,0,
fatal,basket charming fatality mystery paranormal,0,mystery paranormal
fatal,make bad boy,0,
fatal,need team need,0,
fatal,afghan soldier kill general america highest rank fatality vietnam,1,
fatal,usually happen,0,
fatal,cat fatality utica ny pleasant holland ave black cat white paw average size grass north road,0,
fatal,stage fatality close,0,
fatal,see video fatality mileena make sad,0,
fatal,fatality scary af probably good falcon scary,0,
fatal,truck crash lebanon fatality sad expect long delay morning,1,
fatal,yes apparently report cow fatality sadly,1,
fatal,like video mk tremor stalag fatality ermac tournament pharaoh,0,
fatal,add video playlist sws fatality captain falcon snow fox loser,0,
fatal,death loretta fuddy responsible authenticate obama birth certificate sole fatality plane,1,
fatal,everyday near death fatality road thank god,0,
fear,fear factory december deal,0,
fear,friend interesting combine,0,
fear,meaning pick change life overcome fear behold wonder tcc catch light endless,0,
fear,cheekiness bleed computer screen recoil fear,0,
fear,cause know man fear strong minded woman keeper get keep runnin,0,
fear,big fear disappoint people believe,0,
fear,want hurt fear drive midnight,0,
fear,man fear feeling control woman passive aggressively coerce commitment ready,0,
fear,thing fear organization fluctuation disturbance imbalance primary source creativity margaret wheatley,0,
fear,fear factory car official musicvideo,0,
fear,understand umntu wakho trust partner ok know wo fear,0,
fear,photo referencereference xekstrin think nostril eye cry fear partake,0,
fear,fear look know big perrychat,0,perrychat
fear,opposite love fear,1,
fear,fear youtube,0,
fear,help win have share article lifetime fear thank blackinamerica growingupblack,0,blackinamerica growingupblack
fear,refuse nation live fear shoot unawares intoxicated crazy people,1,
fear,horror film incredibly creative artist interview depth anatomy fear,1,
fear,want forever stay special night fear loathing las vegas solitude,0,
fear,bad fear,0,
fear,shake fear gon na hack planet,0,
fear,world finish god say fear choosegod restoringpath,0,choosegod restoringpath
fear,replace fear unknown curiosity open,0,
fear,love god fear hell,0,
fear,tell bride give fear,0,
fear,forfeit year fantasy football pool fear win ass kick,0,
fear,right reopen file fear,0,thexfiles201day
fear,live balanced life balance fear allah hope mercy love,0,allah
fear,big fear eventually way,0,
fear,couple have sex fear let internet movie book say sex ought,0,
fear,fear take risk,1,
fear,untangle require partner fill need love fear besttalkradio listen,0,besttalkradio
fear,walk dead spin fear walk dead,1,
fear,fear,0,
fear,fear lord start knowledge foolish use wisdom teaching amsal,0,
fear,number people deny climate change polar bear article make fear future humanity general,0,
fear,gd idea wrke hard fear life poor fran reed,0,
fear,let fear way achieve dream deltachildren instaquote quoteoftheday disney waltdisney,0,deltachildren instaquote quoteoftheday disney waltdisney
fear,fear motivator,0,
fear,daily reflection august drive drive form fear self delusion self seek self pity,0,
fire,morganite gemstone white fire opal sterling silver ring size,0,
fire,marquei como visto game throne kiss fire bancodeserie,0,bancodeserie
fire,save date saturday august salisbury fire department open house cypres st,0,
fire,cause fire fire fire yeah fire fire fire nowwwwww,1,
fire,avi header combo fire,0,
fire,auction shoe retro fire red,0,auction shoe
fire,asshole fire,0,
fire,cry song end set fire,0,
fire,set thing fire option,1,
fire,sit fire sound great right,0,
fire,fire,0,
fire,flood fire list,1,
fire,politifiact harry reid percent woman serve plan parenthood claim pant fire lie tcot,0,tcot
fire,dear bring canonbringit fire canontattoo mn theresmorewherethatcamefrom,0,canonbringit fire canontattoo mn theresmorewherethatcamefrom
fire,yeah need middle class hating republican hard work cop fire fighter teacher,0,
fire,fire way close wtf go,1,
fire,fire meet gasoline get ta play twice lol,0,
fire,wcw tha bitch fire,0,
fire,feel fire,0,
fire,eye word icy burn rum fire,0,
fire,news politifiact harry reid percent woman serve plan parenthood claim pant fire lie,0,news
fire,good fire,1,
fire,tenshi activate yuki fire card,0,
fire,california shake catch fire overcharge ppl rent past year ai go,1,
fire,fire catalinas look kinda cool picture justice,1,
fire,overwork album gon na fire overwork stress love care,0,
fire,promise tax pancake rainbow die fire,0,
fire,nigga cyhi diss meek suppose shit actually fire,0,
fire,wanna set shit fire,1,
fire,word charlie daniels fire mountain run boy run,1,
fire,check fire lovefood,1,lovefood
fire,heart big obstacle euro dontexpectnothe july fire,0,euro dontexpectnothe july fire
fire,fire wave darkness,0,
fire,fire little burn,0,
fire,smell bon fire drive make wanna sit near make,1,
fire,drop fire selfie tomorrow say welcome ahead time,0,
fire truck,fire brant av drummond rd fire structure single unit car truck,1,
fire truck,psa day fire truck light go,0,
fire truck,rfp fire truck service body fire fighting rescue safety equipment transporta,0,rfp
fire truck,reno truck trailer catch fire reno,1,reno
fire truck,wild night village pugwash fire truck town fire truck house,1,
fire truck,wheeler come strike fire truck spin degree cause roll,1,
fire truck,sigalert update close fwy trash truck fire,1,3***n-133
fire truck,look murder scene cop fire truck fire assistance car helicopter,1,
fire truck,township fire truck philippine langley time philippine,1,philippine
fire truck,township fire truck philippine township langley assistant fire chief pat walker spen,1,
fire truck,garbage truck catch fire lmfao,0,
fire truck,northgate taco truck fire,1,
fire truck,good sign pull work ambulance fire truck bay wompppp friday,1,
fire truck,fire truck ambulance phase hope okay prayforsaipan,1,prayforsaipan
fire truck,sigalert north southbound closed btwn fwy irvine blvd truck fire chp detour traffic,1,sigalert
fire truck,true truck catch fire,1,
fire truck,ohgod xd mean fire truck good xd,0,
fire truck,come fire video enjoy babe way say hi fire truck fireman,0,fireman û
fire truck,past lane reopen lane closed lane open trash truck fire cleanup,1,
fire truck,find cool photo dodge wayne body window bus ex libby mt fire department truck,1,
fire truck,trident chevy fire truck pumper ims fire dept red ho plastic,0,
fire truck,toddler bedding firetruck bundle fire truck firefighter sticker decal sign wall,0,
fire truck,monster truck racer catch fire fair,1,
fire truck,truck fire clog canyon road,1,
fire truck,rgj truck trailer catch fire reno,1,
fire truck,philippine township fire truck philippine emergency equipment cebu philippi,1,philippine
fire truck,fire truck parking lot,0,
fire truck,evening sun article nno,0,
fire truck,choose happy fire truck rest review kick push,0,
fire truck,township fire truck philippine langley time filipino,0,filipino
fire truck,jacksonville fire rescue engine awesome truck official jade fl,1,
fire truck,njturnpike njturnpike reopen hour truck fire,1,njturnpike njturnpike
first respond,lukebox military true hero music,0,lukebox
first respond,grateful responder act swiftly save countless life today,1,
first respond,pray god healing safety responder,0,
first respond,join charity run event start sun sept castle donington community responder,0,charity run
first respond,love way book write include vantage point responder kindle,0,kindle
first respond,responder send wrong address smarttek gps base panic button mper safety,0,smarttek mper safety
first respond,say denver firefighter work curb responder suicide,1,
first respond,cool teen digital responder friend need little help support,0,
first respond,carmike cinema antioch shooting grateful staff responder safety high priority,1,
first respond,roadid thank alex story responder need,0,
first respond,add sandy responder lose home vip home page group,1,
first respond,thankful responder especially life saving response today antioch,1,
first respond,juneau empire responder turn national night,0,
first respond,throw word hero lightly usually reserve responder military hero,0,
first respond,want future responder high tech,0,
first respond,room party responder country annual good,0,
first respond,incase accident responder know baby present,0,
first respond,kirsten gillibrand extend health care responder,1,
first respond,help say denver firefighter work curb responder suicide,1,
first respond,responder convene national summit award gis technology gisuserpr geotech,0,gisuserpr geotech
first respond,york responder compete save life paramedic em,0,paramedic em
first respond,good info help responder individual resilience factsheet,0,
first respond,life lose responder public charge protect,1,
first respond,responder int free saturday detail,0,
first respond,emergency service display meet brave police firefighter responder help safe,1,999day
first respond,week responder dart member participate day intensive technical large animal,1,
first respond,firefighter gain rockyfire jerry brown head area meet responder tomorrow morning,1,rockyfire
first respond,shoot event theater give free coffee responder police firefighter,1,
first respond,lender fee veteran responder past present,0,
flame,new giant flame giant black pantofel info order,1,
flame,new snap tool black baseball hat cap silver gray embroider logo flame,0,
flame,vampiro go table flame ultimalucha luchaunderground,0,ultimalucha luchaunderground
flame,cabin fever flame,0,
flame,summon flame directly hell store buy,0,
flame,add fire flame saturday rick wonder spin guest set chachi,0,
flame,yoga flame,0,
flame,sbnation flame make good penalty killer,0,sbnation flame
flame,guess ig hope go flame,0,
flame,cry pity party flame,0,
flame,new lil chance flame,0,
flame,wish good add flame nail fire,1,
flame,gang walk round brown flame,0,
flame,dude smoke fucking thing go flame bomb go omg scare,1,
flame,maryland mansion fire kill cause damage plug christmas tree report say flame,1,
flame,new giant flame giant manly brown info order,0,
flame,devastation firefighter continue battle flame california benstracy report,1,
flame,watch flame,1,
flame,rp say smoke come silo street hartford flame,1,
flame,choose search joy near smile matter cold flame burn bod portgassdk,0,portgassdk
flame,maryland mansion fire kill cause damage plug christmas tree report say flame firefighter bravery,1,
flame,set flame,0,
flame,optimistic doubt tough feel game pivot defense,0,
flame,pardon burst flame world people mindless game,0,
flame,want burst flame anna hug tightly,0,
flame,selmo catch flame gon na witness slaughter,1,
flame,bloody ell let burn rubybot,0,rubybot
flame,opinion thh internet furst flame,0,
flame,rise follower graph follower past week stat right,0,
flame,gray ophelia red flame blaze person set nearly,1,
flame,soloquiero maryland mansion fire kill cause damage plug christmas tree report say flame firefighte,1,
flame,well shot tomorrow cause record flame throw tomorrow,0,
flame,add video playlist nicki minaj flame official video,0,
flame,well sean bro admit sean flame well sean,0,
flame,advantage apropo flame favorable regard mississauga ontario pwhvgwax,0,
flatten,flatten cartoony whoa papa,0,
flatten,road success pave penny flatten train track welcome,0,
flatten,feel flatten sumo wrestler pain gain muaytai wantmyabsback strong,0,muaytai wantmyabsback strong
flatten,idea food flatten,0,
flatten,zouma flatten cfc,0,cfc
flatten,zouma absolutely flatten guy,0,
flatten,flatten,0,
flatten,year ago atomic attack flatten hiroshima day later nagasaki war crime moscow place,1,hiroshima nagasaki
flatten,today august anniversary bomb little boy drop kill outright city flatten,1,
flatten,flatten little midget,0,
flatten,say yosemite sam drumpf vote flatten rabbit skin huh huh,0,
flatten,flatten machida lose fight nope lose fight guy lose,1,
flatten,flatten early bird de cup lag bout pun de dock watch ppl,0,floored4 flatten
flatten,conklin flatten shuffle foot instead kick slide hand chest,0,
flatten,flatten thee striker,1,
flatten,pick flatten hay man masonite wahpeton nd,0,
flatten,zouma flatten guy,0,
flatten,fylde building set flatten city centre iconic building disappear skyline,0,
flatten,hide kid hide wife loose think flatten ball,0,
flatten,great mbiwa flatten little rat,0,
flatten,puck flatten ball lol,0,
flatten,doubt implicit statement make want flatten bus,0,
flatten,flatten raynor raynor bald imperfect biker marine emo generic western hero,0,
flatten,think risk lose get nose flatten lot,0,
flatten,mum literally pick new car today flatten battery try sort bluetooth muppet,0,muppet
flatten,notley flatten harper heartland harper import ten thousand tfw slave cost albertan job,0,
flatten,flatten frog,0,
flatten,imagine getting flatten kurt zouma,0,
flatten,fallacy steam roller object flatten robertcalifornia thereisonlysex,0,robertcalifornia thereisonlysex
flatten,photo beach earring beach jewelry vacation earring calm beach earring flatten,0,
flatten,mix new flat double sided linerless bottle cap choose mix flatten,0,
flatten,flat football flatten spartan crush day hail,0,hail
flatten,see far dreamy look come face ear flatten start walk slowly,1,
flood,fizzy sit regular flood seat know,0,
flood,jkl cancel flash flood warning bell harlan knox ky wx,1,wx
flood,spot flood combo curved cree lead work light bar offroad fog lamp,1,
flood,small flood bigåêconsequence,1,
flood,homecome queen kill way home prom flood water socialnew,1,socialnew
flood,cree lead work light offroad lamp car truck boat mining flood beam,0,
flood,rain leave drown flood fighter,0,
flood,fish die worldwide flood wonder,0,
flood,flood poor mention work,1,
flood,nt,0,
flood,cree lead work light bar alloy spot flood combo diving offroad boat,0,
flood,cue flood people ironically call,0,
flood,motor hot deal lead work light flood lamp tractor truck suv utv,0,452
flood,lead warm white light motion sensor outdoor flood light pir lamp auc,0,
flood,nnw hana maui co hi county official report coastal flood,1,û
flood,pair new round lead work drive flood light road atv utv read ebay,0,
flood,internet basic flood defective intertissue soul mate milk trench host guabxfv,1,
flood,bmx issue areal flood advisory shelby al till aug pm cdt,1,
flood,flood advisory effect shelby county al pm alwx,1,alwx
flood,grant fund weymouth meeting seawall flood grant set thursday night,1,grant fund
flood,flood advisory issue august edt nws wxky,1,wxky
flood,survive plague float flood peek head mud immune deafening bell god survive,0,
flood,flood prone waterway westchester county eligible million state aid newyork,1,newyork
flood,chinese rescue team arrive myanmar help flood victim sittway,1,
flood,flood advisory issue august cdt august cdt nws urban weather,1,weather
flood,rock spring resident live elk street continue battle flooding issue rain storm,1,
flood,cuban leader extend sympathy vietnam flooding,1,
flood,business sponge dock wash rain flooding,1,
flood,thrust little jam cock deep inside flood womb pussy hot thick cum,0,
flood,severe thunderstorm flash flooding possible mid south midwest weather environment climate nature,1,weather environment climate nature
flood,radar update widespread shower storm move area minor flooding possible hunwx,1,hunwx
flood,tip prevent basement leak create control joint eliminate random cracking homeimprovement flood,0,homeimprovement flood
flood,flood,1,
flood,report flood po area mmda,0,mmda
flood,flooding kill displace pakistan daily news analysis yugvani,1,yugvani
flood,flooding kill displace pakistan daily news analysis,1,
flood,laos flooding village underwater world vision respond,1,laos
flood,flood ukflood british trekker rescue amid flash flood himalayas group british tr flooding,1,flood ukflood flooding
flood,maybe plan dilute safely start charge long come flood,0,
flood,ill dm hotel info people flood notification ask info,0,
flood,wave flood shore find way home anymore look,1,
flood,flooding occur home stop mold growth,1,
flood,flooding track cause derailment sa insubcontinent,1,insubcontinent
flood,chinese flood nyc market,0,
flood,obama keep iraqi christian asylum seeker ndetention flood unscreened muslim,1,
flood,grateful support flood dinner guest thank,1,
flood,flash flooding madison valleywx,1,valleywx
flood,soon start flood comment section come brazil comment bc,0,
flood,year lot drum flood janice fall,0,
